Date,Body,TransactionID,Amount,Category
05/10/2024,You have received 2000 RWF from Jane Smith (*********013) on your mobile money account at 2024-05-10 16:30:51. Message from sender: . Your new balance:2000 RWF. Financial Transaction Id: 76662021700.,,2000,Incoming Money
05/10/2024,"TxId: 73214484437. Your payment of 1,000 RWF to Jane Smith 12845 has been completed at 2024-05-10 16:31:39. Your new balance: 1,000 RWF. Fee was 0 RWF.Kanda*182*16# wiyandikishe muri poromosiyo ya BivaMoMotima, ugire amahirwe yo gutsindira ibihembo bishimishije.",73214484437,"1,000",Payments to Code Holders
05/10/2024,"TxId: 51732411227. Your payment of 600 RWF to Samuel Carter 95464 has been completed at 2024-05-10 21:32:32. Your new balance: 400 RWF. Fee was 0 RWF.Kanda*182*16# wiyandikishe muri poromosiyo ya BivaMoMotima, ugire amahirwe yo gutsindira ibihembo bishimishije.",51732411227,600,Payments to Code Holders
05/11/2024,*113*R*A bank deposit of 40000 RWF has been added to your mobile money account at 2024-05-11 18:43:49. Your NEW BALANCE :40400 RWF. Cash Deposit::CASH::::0::250795963036.Thank you for using MTN MobileMoney.*EN#,,40000,Incoming Money
05/11/2024,"TxId: 17818959211. Your payment of 2,000 RWF to Samuel Carter 14965 has been completed at 2024-05-11 18:48:42. Your new balance: 38,400 RWF. Fee was 0 RWF.Kanda*182*16# wiyandikishe muri poromosiyo ya BivaMoMotima, ugire amahirwe yo gutsindira ibihembo bishimishije.",17818959211,"2,000",Payments to Code Holders
05/11/2024,"*165*S*10000 RWF transferred to Samuel Carter (250791666666) from 36521838 at 2024-05-11 20:34:47 . Fee was: 100 RWF. New balance: 28300 RWF. Kugura ama inite cg interineti kuri MoMo, Kanda *182*2*1# .*EN#",,10000,Transfers to Mobile Numbers
05/12/2024,"*165*S*1000 RWF transferred to Samuel Carter (250790777777) from 36521838 at 2024-05-12 03:47:33 . Fee was: 20 RWF. New balance: 27280 RWF. Kugura ama inite cg interineti kuri MoMo, Kanda *182*2*1# .*EN#",,1000,Transfers to Mobile Numbers
05/12/2024,*162*TxId:13913173274*S*Your payment of 2000 RWF to Airtime with token  has been completed at 2024-05-12 11:41:28. Fee was 0 RWF. Your new balance: 25280 RWF . Message: - -. *EN#,,2000,Payments to Code Holders
05/12/2024,"TxId: 45434420466. Your payment of 10,900 RWF to Jane Smith 59543 has been completed at 2024-05-12 13:26:13. Your new balance: 14,380 RWF. Fee was 0 RWF.Kanda*182*16# wiyandikishe muri poromosiyo ya BivaMoMotima, ugire amahirwe yo gutsindira ibihembo bishimishije.",45434420466,"10,900",Payments to Code Holders
05/12/2024,"TxId: 82113964658. Your payment of 3,500 RWF to Alex Doe 43810 has been completed at 2024-05-12 13:34:25. Your new balance: 10,880 RWF. Fee was 0 RWF.Kanda*182*16# wiyandikishe muri poromosiyo ya BivaMoMotima, ugire amahirwe yo gutsindira ibihembo bishimishije.",82113964658,"3,500",Payments to Code Holders
05/12/2024,"TxId: 26614842768. Your payment of 1,000 RWF to Robert Brown 41193 has been completed at 2024-05-12 17:58:15. Your new balance: 9,880 RWF. Fee was 0 RWF.Kanda*182*16# wiyandikishe muri poromosiyo ya BivaMoMotima, ugire amahirwe yo gutsindira ibihembo bishimishije.",26614842768,"1,000",Payments to Code Holders
05/12/2024,"TxId: 70497610538. Your payment of 5,000 RWF to Linda Green 75028 has been completed at 2024-05-12 18:08:58. Your new balance: 4,880 RWF. Fee was 0 RWF.Kanda*182*16# wiyandikishe muri poromosiyo ya BivaMoMotima, ugire amahirwe yo gutsindira ibihembo bishimishije.",70497610538,"5,000",Payments to Code Holders
05/12/2024,"*165*S*1700 RWF transferred to Samuel Carter (250788999999) from 36521838 at 2024-05-12 19:23:50 . Fee was: 100 RWF. New balance: 3080 RWF. Kugura ama inite cg interineti kuri MoMo, Kanda *182*2*1# .*EN#",,1700,Transfers to Mobile Numbers
05/12/2024,"*165*S*2000 RWF transferred to Alex Doe (250791666666) from 36521838 at 2024-05-12 20:49:30 . Fee was: 100 RWF. New balance: 980 RWF. Kugura ama inite cg interineti kuri MoMo, Kanda *182*2*1# .*EN#",,2000,Transfers to Mobile Numbers
05/14/2024,*113*R*A bank deposit of 5000 RWF has been added to your mobile money account at 2024-05-14 09:10:29. Your NEW BALANCE :5980 RWF. Cash Deposit::CASH::::0::250795963036.Thank you for using MTN MobileMoney.*EN#,,5000,Incoming Money
05/14/2024,"*165*S*1800 RWF transferred to Robert Brown (250788999999) from 36521838 at 2024-05-14 09:11:32 . Fee was: 100 RWF. New balance: 4080 RWF. Kugura ama inite cg interineti kuri MoMo, Kanda *182*2*1# .*EN#",,1800,Transfers to Mobile Numbers
05/14/2024,"*165*S*2500 RWF transferred to Jane Smith (250791666666) from 36521838 at 2024-05-14 09:27:40 . Fee was: 100 RWF. New balance: 1480 RWF. Kugura ama inite cg interineti kuri MoMo, Kanda *182*2*1# .*EN#",,2500,Transfers to Mobile Numbers
05/14/2024,"*165*S*500 RWF transferred to Samuel Carter (250790777777) from 36521838 at 2024-05-14 14:01:57 . Fee was: 20 RWF. New balance: 960 RWF. Kugura ama inite cg interineti kuri MoMo, Kanda *182*2*1# .*EN#",,500,Transfers to Mobile Numbers
05/14/2024,*113*R*A bank deposit of 5000 RWF has been added to your mobile money account at 2024-05-14 19:06:03. Your NEW BALANCE :5960 RWF. Cash Deposit::CASH::::0::250795963036.Thank you for using MTN MobileMoney.*EN#,,5000,Incoming Money
05/14/2024,"*165*S*1800 RWF transferred to Alex Doe (250791666666) from 36521838 at 2024-05-14 19:21:16 . Fee was: 100 RWF. New balance: 4060 RWF. Kugura ama inite cg interineti kuri MoMo, Kanda *182*2*1# .*EN#",,1800,Transfers to Mobile Numbers
05/14/2024,You have received 25000 RWF from Samuel Carter (*********013) on your mobile money account at 2024-05-14 20:57:36. Message from sender: . Your new balance:29060 RWF. Financial Transaction Id: 43668074924.,,25000,Incoming Money
05/14/2024,"*164*S*Y'ello,A transaction of 25000 RWF by DIRECT PAYMENT LTD  on your MOMO account was successfully completed at 2024-05-14 21:01:00. Message from debit receiver: . Your new balance:4060 RWF. Fee was 0 RWF. Financial Transaction Id: 13947831685. External Transaction Id: 47842929.*EN#",,25000,Transfers to Mobile Numbers
05/14/2024,"TxId: 24227321992. Your payment of 1,600 RWF to Linda Green 14166 has been completed at 2024-05-14 21:29:01. Your new balance: 2,460 RWF. Fee was 0 RWF.Kanda*182*16# wiyandikishe muri poromosiyo ya BivaMoMotima, ugire amahirwe yo gutsindira ibihembo bishimishije.",24227321992,"1,600",Payments to Code Holders
05/14/2024,"TxId: 18249226395. Your payment of 2,000 RWF to Alex Doe 23199 has been completed at 2024-05-14 21:29:35. Your new balance: 460 RWF. Fee was 0 RWF.Kanda*182*16# wiyandikishe muri poromosiyo ya BivaMoMotima, ugire amahirwe yo gutsindira ibihembo bishimishije.",18249226395,"2,000",Payments to Code Holders
05/15/2024,*113*R*A bank deposit of 5000 RWF has been added to your mobile money account at 2024-05-15 09:13:09. Your NEW BALANCE :5460 RWF. Cash Deposit::CASH::::0::250795963036.Thank you for using MTN MobileMoney.*EN#,,5000,Incoming Money
05/15/2024,"TxId: 98755359894. Your payment of 1,800 RWF to Alex Doe 73050 has been completed at 2024-05-15 09:16:32. Your new balance: 3,660 RWF. Fee was 0 RWF.Kanda*182*16# wiyandikishe muri poromosiyo ya BivaMoMotima, ugire amahirwe yo gutsindira ibihembo bishimishije.",98755359894,"1,800",Payments to Code Holders
05/15/2024,"*165*S*700 RWF transferred to Jane Smith (250790777777) from 36521838 at 2024-05-15 15:23:28 . Fee was: 20 RWF. New balance: 2940 RWF. Kugura ama inite cg interineti kuri MoMo, Kanda *182*2*1# .*EN#",,700,Transfers to Mobile Numbers
05/15/2024,"*165*S*1500 RWF transferred to Robert Brown (250788999999) from 36521838 at 2024-05-15 18:04:03 . Fee was: 100 RWF. New balance: 1340 RWF. Kugura ama inite cg interineti kuri MoMo, Kanda *182*2*1# .*EN#",,1500,Transfers to Mobile Numbers
05/15/2024,"TxId: 65789139357. Your payment of 1,000 RWF to Alex Doe 46904 has been completed at 2024-05-15 20:38:44. Your new balance: 340 RWF. Fee was 0 RWF.Kanda*182*16# wiyandikishe muri poromosiyo ya BivaMoMotima, ugire amahirwe yo gutsindira ibihembo bishimishije.",65789139357,"1,000",Payments to Code Holders
05/15/2024,*113*R*A bank deposit of 5000 RWF has been added to your mobile money account at 2024-05-15 23:17:44. Your NEW BALANCE :5340 RWF. Cash Deposit::CASH::::0::250795963036.Thank you for using MTN MobileMoney.*EN#,,5000,Incoming Money
05/15/2024,*113*R*A bank deposit of 5000 RWF has been added to your mobile money account at 2024-05-15 23:20:36. Your NEW BALANCE :10340 RWF. Cash Deposit::CASH::::0::250795963036.Thank you for using MTN MobileMoney.*EN#,,5000,Incoming Money
05/15/2024,"*165*S*2800 RWF transferred to Linda Green (250788999999) from 36521838 at 2024-05-15 23:59:11 . Fee was: 100 RWF. New balance: 7440 RWF. Kugura ama inite cg interineti kuri MoMo, Kanda *182*2*1# .*EN#",,2800,Transfers to Mobile Numbers
05/16/2024,"*165*S*1300 RWF transferred to Linda Green (250789888888) from 36521838 at 2024-05-16 02:03:20 . Fee was: 100 RWF. New balance: 6040 RWF. Kugura ama inite cg interineti kuri MoMo, Kanda *182*2*1# .*EN#",,1300,Transfers to Mobile Numbers
05/16/2024,"TxId: 16913786322. Your payment of 2,150 RWF to Linda Green 20428 has been completed at 2024-05-16 21:35:36. Your new balance: 3,890 RWF. Fee was 0 RWF.Kanda*182*16# wiyandikishe muri poromosiyo ya BivaMoMotima, ugire amahirwe yo gutsindira ibihembo bishimishije.",16913786322,"2,150",Payments to Code Holders
05/17/2024,"*165*S*1500 RWF transferred to Jane Smith (250790777777) from 36521838 at 2024-05-17 10:35:37 . Fee was: 100 RWF. New balance: 2290 RWF. Kugura ama inite cg interineti kuri MoMo, Kanda *182*2*1# .*EN#",,1500,Transfers to Mobile Numbers
05/17/2024,"*165*S*1500 RWF transferred to Jane Smith (250791666666) from 36521838 at 2024-05-17 18:49:21 . Fee was: 100 RWF. New balance: 690 RWF. Kugura ama inite cg interineti kuri MoMo, Kanda *182*2*1# .*EN#",,1500,Transfers to Mobile Numbers
05/18/2024,*113*R*A bank deposit of 5000 RWF has been added to your mobile money account at 2024-05-18 08:11:36. Your NEW BALANCE :5690 RWF. Cash Deposit::CASH::::0::250795963036.Thank you for using MTN MobileMoney.*EN#,,5000,Incoming Money
05/18/2024,"TxId: 30173936259. Your payment of 1,500 RWF to Robert Brown 52128 has been completed at 2024-05-18 08:15:31. Your new balance: 4,190 RWF. Fee was 0 RWF.Kanda*182*16# wiyandikishe muri poromosiyo ya BivaMoMotima, ugire amahirwe yo gutsindira ibihembo bishimishije.",30173936259,"1,500",Payments to Code Holders
05/18/2024,*113*R*A bank deposit of 5000 RWF has been added to your mobile money account at 2024-05-18 08:48:00. Your NEW BALANCE :9190 RWF. Cash Deposit::CASH::::0::250795963036.Thank you for using MTN MobileMoney.*EN#,,5000,Incoming Money
05/18/2024,"TxId: 38084447123. Your payment of 6,000 RWF to Jane Smith 48045 has been completed at 2024-05-18 08:48:28. Your new balance: 3,190 RWF. Fee was 0 RWF.Kanda*182*16# wiyandikishe muri poromosiyo ya BivaMoMotima, ugire amahirwe yo gutsindira ibihembo bishimishije.",38084447123,"6,000",Payments to Code Holders
05/19/2024,You have received 1400 RWF from Linda Green (*********704) on your mobile money account at 2024-05-19 01:49:09. Message from sender: . Your new balance:4590 RWF. Financial Transaction Id: 45738348638.,,1400,Incoming Money
05/20/2024,"*165*S*500 RWF transferred to Robert Brown (250791666666) from 36521838 at 2024-05-20 09:32:49 . Fee was: 20 RWF. New balance: 4070 RWF. Kugura ama inite cg interineti kuri MoMo, Kanda *182*2*1# .*EN#",,500,Transfers to Mobile Numbers
05/20/2024,"TxId: 32894434269. Your payment of 1,500 RWF to Jane Smith 61445 has been completed at 2024-05-20 16:55:34. Your new balance: 2,570 RWF. Fee was 0 RWF.Kanda*182*16# wiyandikishe muri poromosiyo ya BivaMoMotima, ugire amahirwe yo gutsindira ibihembo bishimishije.",32894434269,"1,500",Payments to Code Holders
05/20/2024,"*165*S*1500 RWF transferred to Robert Brown (250789888888) from 36521838 at 2024-05-20 17:05:45 . Fee was: 100 RWF. New balance: 970 RWF. Kugura ama inite cg interineti kuri MoMo, Kanda *182*2*1# .*EN#",,1500,Transfers to Mobile Numbers
05/20/2024,*113*R*A bank deposit of 5000 RWF has been added to your mobile money account at 2024-05-20 17:45:23. Your NEW BALANCE :5970 RWF. Cash Deposit::CASH::::0::250795963036.Thank you for using MTN MobileMoney.*EN#,,5000,Incoming Money
05/20/2024,"*165*S*1000 RWF transferred to Jane Smith (250788999999) from 36521838 at 2024-05-20 17:45:59 . Fee was: 20 RWF. New balance: 4950 RWF. Kugura ama inite cg interineti kuri MoMo, Kanda *182*2*1# .*EN#",,1000,Transfers to Mobile Numbers
05/21/2024,"*165*S*1500 RWF transferred to Samuel Carter (250791666666) from 36521838 at 2024-05-21 14:38:14 . Fee was: 100 RWF. New balance: 3350 RWF. Kugura ama inite cg interineti kuri MoMo, Kanda *182*2*1# .*EN#",,1500,Transfers to Mobile Numbers
05/21/2024,"*165*S*1700 RWF transferred to Jane Smith (250788999999) from 36521838 at 2024-05-21 17:42:48 . Fee was: 100 RWF. New balance: 1550 RWF. Kugura ama inite cg interineti kuri MoMo, Kanda *182*2*1# .*EN#",,1700,Transfers to Mobile Numbers
05/21/2024,*113*R*A bank deposit of 5000 RWF has been added to your mobile money account at 2024-05-21 18:15:06. Your NEW BALANCE :6550 RWF. Cash Deposit::CASH::::0::250795963036.Thank you for using MTN MobileMoney.*EN#,,5000,Incoming Money
05/21/2024,"*165*S*5000 RWF transferred to Jane Smith (250789888888) from 36521838 at 2024-05-21 18:15:41 . Fee was: 100 RWF. New balance: 1450 RWF. Kugura ama inite cg interineti kuri MoMo, Kanda *182*2*1# .*EN#",,5000,Transfers to Mobile Numbers
05/22/2024,*113*R*A bank deposit of 5000 RWF has been added to your mobile money account at 2024-05-22 13:44:11. Your NEW BALANCE :6450 RWF. Cash Deposit::CASH::::0::250795963036.Thank you for using MTN MobileMoney.*EN#,,5000,Incoming Money
05/22/2024,"TxId: 61189493387. Your payment of 3,500 RWF to Robert Brown 61316 has been completed at 2024-05-22 13:44:59. Your new balance: 2,950 RWF. Fee was 0 RWF.Kanda*182*16# wiyandikishe muri poromosiyo ya BivaMoMotima, ugire amahirwe yo gutsindira ibihembo bishimishije.",61189493387,"3,500",Payments to Code Holders
05/23/2024,"TxId: 37467134419. Your payment of 1,800 RWF to Robert Brown 28481 has been completed at 2024-05-23 09:51:43. Your new balance: 1,150 RWF. Fee was 0 RWF.Kanda*182*16# wiyandikishe muri poromosiyo ya BivaMoMotima, ugire amahirwe yo gutsindira ibihembo bishimishije.",37467134419,"1,800",Payments to Code Holders
05/24/2024,*113*R*A bank deposit of 5000 RWF has been added to your mobile money account at 2024-05-24 11:43:17. Your NEW BALANCE :6150 RWF. Cash Deposit::CASH::::0::250795963036.Thank you for using MTN MobileMoney.*EN#,,5000,Incoming Money
05/24/2024,"*165*S*1800 RWF transferred to Jane Smith (250791666666) from 36521838 at 2024-05-24 11:43:58 . Fee was: 100 RWF. New balance: 4250 RWF. Kugura ama inite cg interineti kuri MoMo, Kanda *182*2*1# .*EN#",,1800,Transfers to Mobile Numbers
05/24/2024,"TxId: 12131092250. Your payment of 1,000 RWF to Samuel Carter 98117 has been completed at 2024-05-24 13:10:41. Your new balance: 3,250 RWF. Fee was 0 RWF.Kanda*182*16# wiyandikishe muri poromosiyo ya BivaMoMotima, ugire amahirwe yo gutsindira ibihembo bishimishije.",12131092250,"1,000",Payments to Code Holders
05/24/2024,"TxId: 35617026753. Your payment of 1,500 RWF to Alex Doe 22692 has been completed at 2024-05-24 16:41:03. Your new balance: 1,750 RWF. Fee was 0 RWF.Kanda*182*16# wiyandikishe muri poromosiyo ya BivaMoMotima, ugire amahirwe yo gutsindira ibihembo bishimishije.",35617026753,"1,500",Payments to Code Holders
05/24/2024,"*165*S*1600 RWF transferred to Samuel Carter (250791666666) from 36521838 at 2024-05-24 18:18:36 . Fee was: 100 RWF. New balance: 50 RWF. Kugura ama inite cg interineti kuri MoMo, Kanda *182*2*1# .*EN#",,1600,Transfers to Mobile Numbers
05/24/2024,*113*R*A bank deposit of 5000 RWF has been added to your mobile money account at 2024-05-24 23:04:07. Your NEW BALANCE :5050 RWF. Cash Deposit::CASH::::0::250795963036.Thank you for using MTN MobileMoney.*EN#,,5000,Incoming Money
05/24/2024,"TxId: 59168184137. Your payment of 2,000 RWF to Alex Doe 14717 has been completed at 2024-05-24 23:07:44. Your new balance: 3,050 RWF. Fee was 0 RWF.Kanda*182*16# wiyandikishe muri poromosiyo ya BivaMoMotima, ugire amahirwe yo gutsindira ibihembo bishimishije.",59168184137,"2,000",Payments to Code Holders
05/25/2024,"TxId: 47570656030. Your payment of 2,000 RWF to Samuel Carter 23701 has been completed at 2024-05-25 04:54:54. Your new balance: 1,050 RWF. Fee was 0 RWF.Kanda*182*16# wiyandikishe muri poromosiyo ya BivaMoMotima, ugire amahirwe yo gutsindira ibihembo bishimishije.",47570656030,"2,000",Payments to Code Holders
05/25/2024,*113*R*A bank deposit of 5000 RWF has been added to your mobile money account at 2024-05-25 11:18:40. Your NEW BALANCE :6050 RWF. Cash Deposit::CASH::::0::250795963036.Thank you for using MTN MobileMoney.*EN#,,5000,Incoming Money
05/25/2024,"TxId: 95960893947. Your payment of 2,000 RWF to Samuel Carter 19954 has been completed at 2024-05-25 11:19:23. Your new balance: 4,050 RWF. Fee was 0 RWF.Kanda*182*16# wiyandikishe muri poromosiyo ya BivaMoMotima, ugire amahirwe yo gutsindira ibihembo bishimishije.",95960893947,"2,000",Payments to Code Holders
05/25/2024,*113*R*A bank deposit of 5000 RWF has been added to your mobile money account at 2024-05-25 17:18:07. Your NEW BALANCE :9050 RWF. Cash Deposit::CASH::::0::250795963036.Thank you for using MTN MobileMoney.*EN#,,5000,Incoming Money
05/25/2024,*113*R*A bank deposit of 5000 RWF has been added to your mobile money account at 2024-05-25 17:19:48. Your NEW BALANCE :14050 RWF. Cash Deposit::CASH::::0::250795963036.Thank you for using MTN MobileMoney.*EN#,,5000,Incoming Money
05/25/2024,"TxId: 43786042083. Your payment of 9,300 RWF to Jane Smith 15975 has been completed at 2024-05-25 17:20:20. Your new balance: 4,750 RWF. Fee was 0 RWF.Kanda*182*16# wiyandikishe muri poromosiyo ya BivaMoMotima, ugire amahirwe yo gutsindira ibihembo bishimishije.",43786042083,"9,300",Payments to Code Holders
05/25/2024,"TxId: 51199793551. Your payment of 2,000 RWF to Samuel Carter 24729 has been completed at 2024-05-25 19:50:55. Your new balance: 2,750 RWF. Fee was 0 RWF.Kanda*182*16# wiyandikishe muri poromosiyo ya BivaMoMotima, ugire amahirwe yo gutsindira ibihembo bishimishije.",51199793551,"2,000",Payments to Code Holders
05/25/2024,"TxId: 90057863776. Your payment of 1,000 RWF to Jane Smith 55799 has been completed at 2024-05-25 23:47:53. Your new balance: 1,750 RWF. Fee was 0 RWF.Kanda*182*16# wiyandikishe muri poromosiyo ya BivaMoMotima, ugire amahirwe yo gutsindira ibihembo bishimishije.",90057863776,"1,000",Payments to Code Holders
05/26/2024,*113*R*A bank deposit of 25000 RWF has been added to your mobile money account at 2024-05-26 02:06:45. Your NEW BALANCE :26750 RWF. Cash Deposit::CASH::::0::250795963036.Thank you for using MTN MobileMoney.*EN#,,25000,Incoming Money
05/26/2024,"You Abebe Chala CHEBUDIE (*********036) have via agent: Agent Sophia (250790777777), withdrawn 20000 RWF from your mobile money account: 36521838 at 2024-05-26 02:10:27 and you can now collect your money in cash. Your new balance: 6400 RWF. Fee paid: 350 RWF. Message from agent: 1. Financial Transaction Id: 14098463509.",,20000,Withdrawals from Agents
05/26/2024,"*165*S*1500 RWF transferred to Jane Smith (250791666666) from 36521838 at 2024-05-26 02:24:44 . Fee was: 100 RWF. New balance: 4800 RWF. Kugura ama inite cg interineti kuri MoMo, Kanda *182*2*1# .*EN#",,1500,Transfers to Mobile Numbers
05/26/2024,"<#> Dear Customer, your MTN MoMo application one-time password is :2476.MTN MoMo does not recommend that you share or expose your one-time password with anyone. Be Vigilant. RdbS6eMOXvx N/RywfrtIZL>.",,,MTN SMS
05/26/2024,"<#> Dear Customer, your MTN MoMo application one-time password is :2527.MTN MoMo does not recommend that you share or expose your one-time password with anyone. Be Vigilant. RdbS6eMOXvx N/RywfrtIZL>.",,,MTN SMS
05/26/2024,"<#> Dear Customer, your MTN MoMo application one-time password is :2900.MTN MoMo does not recommend that you share or expose your one-time password with anyone. Be Vigilant. RdbS6eMOXvx N/RywfrtIZL>.",,,MTN SMS
05/26/2024,*162*TxId:14103506143*S*Your payment of 4000 RWF to MTN Cash Power with token 72962-79980-44699-06073 has been completed at 2024-05-26 13:31:00. Fee was 0 RWF. Your new balance: 800 RWF . Message: - -. *EN#,,4000,Payments to Code Holders
05/26/2024,*113*R*A bank deposit of 25000 RWF has been added to your mobile money account at 2024-05-26 14:49:08. Your NEW BALANCE :25800 RWF. Cash Deposit::CASH::::0::250795963036.Thank you for using MTN MobileMoney.*EN#,,25000,Incoming Money
05/26/2024,"<#> Dear Customer, your MTN MoMo application one-time password is :9591.MTN MoMo does not recommend that you share or expose your one-time password with anyone. Be Vigilant. RdbS6eMOXvx N/RywfrtIZL>.",,,MTN SMS
05/26/2024,"*165*S*25000 RWF transferred to Samuel Carter (250789888888) from 36521838 at 2024-05-26 14:51:13 . Fee was: 250 RWF. New balance: 550 RWF. Kugura ama inite cg interineti kuri MoMo, Kanda *182*2*1# .*EN#",,25000,Transfers to Mobile Numbers
05/26/2024,*113*R*A bank deposit of 10000 RWF has been added to your mobile money account at 2024-05-26 15:44:53. Your NEW BALANCE :10550 RWF. Cash Deposit::CASH::::0::250795963036.Thank you for using MTN MobileMoney.*EN#,,10000,Incoming Money
05/26/2024,"*165*S*10000 RWF transferred to Samuel Carter (250791666666) from 36521838 at 2024-05-26 16:01:09 . Fee was: 100 RWF. New balance: 450 RWF. Kugura ama inite cg interineti kuri MoMo, Kanda *182*2*1# .*EN#",,10000,Transfers to Mobile Numbers
05/26/2024,"<#> Dear Customer, your MTN MoMo application one-time password is :4666.MTN MoMo does not recommend that you share or expose your one-time password with anyone. Be Vigilant. RdbS6eMOXvx N/RywfrtIZL>.",,,MTN SMS
05/26/2024,*113*R*A bank deposit of 10000 RWF has been added to your mobile money account at 2024-05-26 17:18:51. Your NEW BALANCE :10450 RWF. Cash Deposit::CASH::::0::250795963036.Thank you for using MTN MobileMoney.*EN#,,10000,Incoming Money
05/26/2024,"TxId: 65035082869. Your payment of 8,000 RWF to Jane Smith 51116 has been completed at 2024-05-26 17:19:28. Your new balance: 2,450 RWF. Fee was 0 RWF.Kanda*182*16# wiyandikishe muri poromosiyo ya BivaMoMotima, ugire amahirwe yo gutsindira ibihembo bishimishije.",65035082869,"8,000",Payments to Code Holders
05/26/2024,"TxId: 23112980564. Your payment of 2,000 RWF to Robert Brown 11803 has been completed at 2024-05-26 18:46:37. Your new balance: 450 RWF. Fee was 0 RWF.Kanda*182*16# wiyandikishe muri poromosiyo ya BivaMoMotima, ugire amahirwe yo gutsindira ibihembo bishimishije.",23112980564,"2,000",Payments to Code Holders
05/27/2024,*113*R*A bank deposit of 5000 RWF has been added to your mobile money account at 2024-05-27 07:57:08. Your NEW BALANCE :5450 RWF. Cash Deposit::CASH::::0::250795963036.Thank you for using MTN MobileMoney.*EN#,,5000,Incoming Money
05/27/2024,"TxId: 97391079490. Your payment of 1,700 RWF to Samuel Carter 71141 has been completed at 2024-05-27 08:01:47. Your new balance: 3,750 RWF. Fee was 0 RWF.Kanda*182*16# wiyandikishe muri poromosiyo ya BivaMoMotima, ugire amahirwe yo gutsindira ibihembo bishimishije.",97391079490,"1,700",Payments to Code Holders
05/27/2024,"*165*S*1500 RWF transferred to Jane Smith (250789888888) from 36521838 at 2024-05-27 14:45:58 . Fee was: 100 RWF. New balance: 2150 RWF. Kugura ama inite cg interineti kuri MoMo, Kanda *182*2*1# .*EN#",,1500,Transfers to Mobile Numbers
05/27/2024,"<#> Dear Customer, your MTN MoMo application one-time password is :0086.MTN MoMo does not recommend that you share or expose your one-time password with anyone. Be Vigilant. RdbS6eMOXvx N/RywfrtIZL>.",,,MTN SMS
05/27/2024,*162*TxId:14121530824*S*Your payment of 2000 RWF to Airtime with token  has been completed at 2024-05-27 18:40:46. Fee was 0 RWF. Your new balance: 150 RWF . Message: - -. *EN#,,2000,Payments to Code Holders
05/28/2024,*113*R*A bank deposit of 30000 RWF has been added to your mobile money account at 2024-05-28 07:21:39. Your NEW BALANCE :30150 RWF. Cash Deposit::CASH::::0::250795963036.Thank you for using MTN MobileMoney.*EN#,,30000,Incoming Money
05/28/2024,"*165*S*27000 RWF transferred to Samuel Carter (250791666666) from 36521838 at 2024-05-28 07:22:45 . Fee was: 250 RWF. New balance: 2900 RWF. Kugura ama inite cg interineti kuri MoMo, Kanda *182*2*1# .*EN#",,27000,Transfers to Mobile Numbers
05/28/2024,"TxId: 28021128029. Your payment of 1,500 RWF to Alex Doe 44654 has been completed at 2024-05-28 17:34:02. Your new balance: 1,400 RWF. Fee was 0 RWF.Kanda*182*16# wiyandikishe muri poromosiyo ya BivaMoMotima, ugire amahirwe yo gutsindira ibihembo bishimishije.",28021128029,"1,500",Payments to Code Holders
05/29/2024,You have received 200 RWF from Linda Green (*********691) on your mobile money account at 2024-05-29 14:00:51. Message from sender: . Your new balance:1600 RWF. Financial Transaction Id: 90281203550.,,200,Incoming Money
05/29/2024,*113*R*A bank deposit of 15000 RWF has been added to your mobile money account at 2024-05-29 17:18:18. Your NEW BALANCE :16600 RWF. Cash Deposit::CASH::::0::250795963036.Thank you for using MTN MobileMoney.*EN#,,15000,Incoming Money
05/29/2024,"*165*S*10000 RWF transferred to Alex Doe (250791666666) from 36521838 at 2024-05-29 17:19:05 . Fee was: 100 RWF. New balance: 6500 RWF. Kugura ama inite cg interineti kuri MoMo, Kanda *182*2*1# .*EN#",,10000,Transfers to Mobile Numbers
05/29/2024,"*165*S*6000 RWF transferred to Alex Doe (250788999999) from 36521838 at 2024-05-29 19:08:37 . Fee was: 100 RWF. New balance: 400 RWF. Kugura ama inite cg interineti kuri MoMo, Kanda *182*2*1# .*EN#",,6000,Transfers to Mobile Numbers
05/30/2024,*113*R*A bank deposit of 5000 RWF has been added to your mobile money account at 2024-05-30 12:13:58. Your NEW BALANCE :5400 RWF. Cash Deposit::CASH::::0::250795963036.Thank you for using MTN MobileMoney.*EN#,,5000,Incoming Money
05/30/2024,"TxId: 59054859038. Your payment of 1,800 RWF to Jane Smith 39230 has been completed at 2024-05-30 12:14:29. Your new balance: 3,600 RWF. Fee was 0 RWF.Kanda*182*16# wiyandikishe muri poromosiyo ya BivaMoMotima, ugire amahirwe yo gutsindira ibihembo bishimishije.",59054859038,"1,800",Payments to Code Holders
05/30/2024,"*165*S*1200 RWF transferred to Jane Smith (250789888888) from 36521838 at 2024-05-30 17:03:08 . Fee was: 100 RWF. New balance: 2300 RWF. Kugura ama inite cg interineti kuri MoMo, Kanda *182*2*1# .*EN#",,1200,Transfers to Mobile Numbers
05/30/2024,"*165*S*1500 RWF transferred to Robert Brown (250791666666) from 36521838 at 2024-05-30 19:06:00 . Fee was: 100 RWF. New balance: 700 RWF. Kugura ama inite cg interineti kuri MoMo, Kanda *182*2*1# .*EN#",,1500,Transfers to Mobile Numbers
05/31/2024,*113*R*A bank deposit of 5000 RWF has been added to your mobile money account at 2024-05-31 09:39:09. Your NEW BALANCE :5700 RWF. Cash Deposit::CASH::::0::250795963036.Thank you for using MTN MobileMoney.*EN#,,5000,Incoming Money
05/31/2024,"TxId: 49894890981. Your payment of 1,700 RWF to Linda Green 61690 has been completed at 2024-05-31 09:39:36. Your new balance: 4,000 RWF. Fee was 0 RWF.Kanda*182*16# wiyandikishe muri poromosiyo ya BivaMoMotima, ugire amahirwe yo gutsindira ibihembo bishimishije.",49894890981,"1,700",Payments to Code Holders
05/31/2024,"TxId: 36362293540. Your payment of 1,500 RWF to Jane Smith 80677 has been completed at 2024-05-31 12:57:20. Your new balance: 2,500 RWF. Fee was 0 RWF.Kanda*182*16# wiyandikishe muri poromosiyo ya BivaMoMotima, ugire amahirwe yo gutsindira ibihembo bishimishije.",36362293540,"1,500",Payments to Code Holders
05/31/2024,"*165*S*1000 RWF transferred to Linda Green (250788999999) from 36521838 at 2024-05-31 15:39:56 . Fee was: 20 RWF. New balance: 1480 RWF. Kugura ama inite cg interineti kuri MoMo, Kanda *182*2*1# .*EN#",,1000,Transfers to Mobile Numbers
06/01/2024,*113*R*A bank deposit of 5000 RWF has been added to your mobile money account at 2024-06-01 01:28:58. Your NEW BALANCE :6480 RWF. Cash Deposit::CASH::::0::250795963036.Thank you for using MTN MobileMoney.*EN#,,5000,Incoming Money
06/01/2024,"*165*S*1500 RWF transferred to Samuel Carter (250789888888) from 36521838 at 2024-06-01 01:43:33 . Fee was: 100 RWF. New balance: 4880 RWF. Kugura ama inite cg interineti kuri MoMo, Kanda *182*2*1# .*EN#",,1500,Transfers to Mobile Numbers
06/01/2024,*113*R*A bank deposit of 5000 RWF has been added to your mobile money account at 2024-06-01 11:28:55. Your NEW BALANCE :9880 RWF. Cash Deposit::CASH::::0::250795963036.Thank you for using MTN MobileMoney.*EN#,,5000,Incoming Money
06/01/2024,"*165*S*5000 RWF transferred to Jane Smith (250790777777) from 36521838 at 2024-06-01 11:30:05 . Fee was: 100 RWF. New balance: 4780 RWF. Kugura ama inite cg interineti kuri MoMo, Kanda *182*2*1# .*EN#",,5000,Transfers to Mobile Numbers
06/01/2024,"TxId: 38069282043. Your payment of 4,050 RWF to Jane Smith 20505 has been completed at 2024-06-01 14:35:41. Your new balance: 730 RWF. Fee was 0 RWF.Kanda*182*16# wiyandikishe muri poromosiyo ya BivaMoMotima, ugire amahirwe yo gutsindira ibihembo bishimishije.",38069282043,"4,050",Payments to Code Holders
06/01/2024,*113*R*A bank deposit of 15000 RWF has been added to your mobile money account at 2024-06-01 19:46:10. Your NEW BALANCE :15730 RWF. Cash Deposit::CASH::::0::250795963036.Thank you for using MTN MobileMoney.*EN#,,15000,Incoming Money
06/01/2024,"TxId: 66215693108. Your payment of 1,000 RWF to Samuel Carter 81957 has been completed at 2024-06-01 19:46:46. Your new balance: 14,730 RWF. Fee was 0 RWF.Kanda*182*16# wiyandikishe muri poromosiyo ya BivaMoMotima, ugire amahirwe yo gutsindira ibihembo bishimishije.",66215693108,"1,000",Payments to Code Holders
06/01/2024,"TxId: 37706238756. Your payment of 900 RWF to Robert Brown 96964 has been completed at 2024-06-01 19:48:05. Your new balance: 13,830 RWF. Fee was 0 RWF.Kanda*182*16# wiyandikishe muri poromosiyo ya BivaMoMotima, ugire amahirwe yo gutsindira ibihembo bishimishije.",37706238756,900,Payments to Code Holders
06/01/2024,"*165*S*10000 RWF transferred to Alex Doe (250790777777) from 36521838 at 2024-06-01 19:49:38 . Fee was: 100 RWF. New balance: 3730 RWF. Kugura ama inite cg interineti kuri MoMo, Kanda *182*2*1# .*EN#",,10000,Transfers to Mobile Numbers
06/01/2024,"TxId: 22989641020. Your payment of 1,500 RWF to Linda Green 38423 has been completed at 2024-06-01 19:51:37. Your new balance: 2,230 RWF. Fee was 0 RWF.Kanda*182*16# wiyandikishe muri poromosiyo ya BivaMoMotima, ugire amahirwe yo gutsindira ibihembo bishimishije.",22989641020,"1,500",Payments to Code Holders
06/02/2024,"*165*S*2000 RWF transferred to Alex Doe (250790777777) from 36521838 at 2024-06-02 17:28:41 . Fee was: 100 RWF. New balance: 130 RWF. Kugura ama inite cg interineti kuri MoMo, Kanda *182*2*1# .*EN#",,2000,Transfers to Mobile Numbers
06/02/2024,*113*R*A bank deposit of 5000 RWF has been added to your mobile money account at 2024-06-02 20:56:47. Your NEW BALANCE :5130 RWF. Cash Deposit::CASH::::0::250795963036.Thank you for using MTN MobileMoney.*EN#,,5000,Incoming Money
06/02/2024,"TxId: 28025360855. Your payment of 2,000 RWF to Alex Doe 65474 has been completed at 2024-06-02 21:10:45. Your new balance: 3,130 RWF. Fee was 0 RWF.Kanda*182*16# wiyandikishe muri poromosiyo ya BivaMoMotima, ugire amahirwe yo gutsindira ibihembo bishimishije.",28025360855,"2,000",Payments to Code Holders
06/03/2024,"*165*S*1500 RWF transferred to Robert Brown (250788999999) from 36521838 at 2024-06-03 09:24:24 . Fee was: 100 RWF. New balance: 1530 RWF. Kugura ama inite cg interineti kuri MoMo, Kanda *182*2*1# .*EN#",,1500,Transfers to Mobile Numbers
06/03/2024,*113*R*A bank deposit of 5000 RWF has been added to your mobile money account at 2024-06-03 13:08:48. Your NEW BALANCE :6530 RWF. Cash Deposit::CASH::::0::250795963036.Thank you for using MTN MobileMoney.*EN#,,5000,Incoming Money
06/03/2024,"TxId: 32615649069. Your payment of 3,500 RWF to Jane Smith 14003 has been completed at 2024-06-03 13:10:42. Your new balance: 3,030 RWF. Fee was 0 RWF.Kanda*182*16# wiyandikishe muri poromosiyo ya BivaMoMotima, ugire amahirwe yo gutsindira ibihembo bishimishije.",32615649069,"3,500",Payments to Code Holders
06/03/2024,"*165*S*1500 RWF transferred to Alex Doe (250791666666) from 36521838 at 2024-06-03 13:32:11 . Fee was: 100 RWF. New balance: 1430 RWF. Kugura ama inite cg interineti kuri MoMo, Kanda *182*2*1# .*EN#",,1500,Transfers to Mobile Numbers
06/03/2024,*113*R*A bank deposit of 5000 RWF has been added to your mobile money account at 2024-06-03 15:32:37. Your NEW BALANCE :6430 RWF. Cash Deposit::CASH::::0::250795963036.Thank you for using MTN MobileMoney.*EN#,,5000,Incoming Money
06/03/2024,"*165*S*1500 RWF transferred to Linda Green (250790777777) from 36521838 at 2024-06-03 15:33:15 . Fee was: 100 RWF. New balance: 4830 RWF. Kugura ama inite cg interineti kuri MoMo, Kanda *182*2*1# .*EN#",,1500,Transfers to Mobile Numbers
06/03/2024,"*165*S*1500 RWF transferred to Samuel Carter (250788999999) from 36521838 at 2024-06-03 17:55:27 . Fee was: 100 RWF. New balance: 3230 RWF. Kugura ama inite cg interineti kuri MoMo, Kanda *182*2*1# .*EN#",,1500,Transfers to Mobile Numbers
06/03/2024,*113*R*A bank deposit of 5000 RWF has been added to your mobile money account at 2024-06-03 18:56:18. Your NEW BALANCE :8230 RWF. Cash Deposit::CASH::::0::250795963036.Thank you for using MTN MobileMoney.*EN#,,5000,Incoming Money
06/03/2024,"TxId: 21910499837. Your payment of 4,800 RWF to Alex Doe 46942 has been completed at 2024-06-03 18:57:19. Your new balance: 3,430 RWF. Fee was 0 RWF.Kanda*182*16# wiyandikishe muri poromosiyo ya BivaMoMotima, ugire amahirwe yo gutsindira ibihembo bishimishije.",21910499837,"4,800",Payments to Code Holders
06/03/2024,"TxId: 40412577651. Your payment of 1,300 RWF to Samuel Carter 46893 has been completed at 2024-06-03 19:34:13. Your new balance: 2,130 RWF. Fee was 0 RWF.Kanda*182*16# wiyandikishe muri poromosiyo ya BivaMoMotima, ugire amahirwe yo gutsindira ibihembo bishimishije.",40412577651,"1,300",Payments to Code Holders
06/04/2024,"TxId: 44021806588. Your payment of 1,500 RWF to Linda Green 96637 has been completed at 2024-06-04 09:32:38. Your new balance: 630 RWF. Fee was 0 RWF.Kanda*182*16# wiyandikishe muri poromosiyo ya BivaMoMotima, ugire amahirwe yo gutsindira ibihembo bishimishije.",44021806588,"1,500",Payments to Code Holders
06/04/2024,*113*R*A bank deposit of 5000 RWF has been added to your mobile money account at 2024-06-04 13:51:52. Your NEW BALANCE :5630 RWF. Cash Deposit::CASH::::0::250795963036.Thank you for using MTN MobileMoney.*EN#,,5000,Incoming Money
06/04/2024,"TxId: 70782527436. Your payment of 3,500 RWF to Robert Brown 25426 has been completed at 2024-06-04 13:52:25. Your new balance: 2,130 RWF. Fee was 0 RWF.Kanda*182*16# wiyandikishe muri poromosiyo ya BivaMoMotima, ugire amahirwe yo gutsindira ibihembo bishimishije.",70782527436,"3,500",Payments to Code Holders
06/04/2024,"TxId: 15037119744. Your payment of 2,100 RWF to Alex Doe 72233 has been completed at 2024-06-04 21:19:34. Your new balance: 30 RWF. Fee was 0 RWF.Kanda*182*16# wiyandikishe muri poromosiyo ya BivaMoMotima, ugire amahirwe yo gutsindira ibihembo bishimishije.",15037119744,"2,100",Payments to Code Holders
06/05/2024,*113*R*A bank deposit of 10000 RWF has been added to your mobile money account at 2024-06-05 09:49:25. Your NEW BALANCE :10030 RWF. Cash Deposit::CASH::::0::250795963036.Thank you for using MTN MobileMoney.*EN#,,10000,Incoming Money
06/05/2024,"*165*S*2000 RWF transferred to Robert Brown (250788999999) from 36521838 at 2024-06-05 09:49:59 . Fee was: 100 RWF. New balance: 7930 RWF. Kugura ama inite cg interineti kuri MoMo, Kanda *182*2*1# .*EN#",,2000,Transfers to Mobile Numbers
06/05/2024,"*165*S*3500 RWF transferred to Jane Smith (250789888888) from 36521838 at 2024-06-05 14:01:38 . Fee was: 100 RWF. New balance: 4330 RWF. Kugura ama inite cg interineti kuri MoMo, Kanda *182*2*1# .*EN#",,3500,Transfers to Mobile Numbers
06/05/2024,*113*R*A bank deposit of 21000 RWF has been added to your mobile money account at 2024-06-05 17:19:19. Your NEW BALANCE :25330 RWF. Cash Deposit::CASH::::0::250795963036.Thank you for using MTN MobileMoney.*EN#,,21000,Incoming Money
06/05/2024,"TxId: 25107231114. Your payment of 24,500 RWF to Alex Doe 27079 has been completed at 2024-06-05 17:19:49. Your new balance: 830 RWF. Fee was 0 RWF.Kanda*182*16# wiyandikishe muri poromosiyo ya BivaMoMotima, ugire amahirwe yo gutsindira ibihembo bishimishije.",25107231114,"24,500",Payments to Code Holders
06/05/2024,*113*R*A bank deposit of 200000 RWF has been added to your mobile money account at 2024-06-05 18:03:43. Your NEW BALANCE :200830 RWF. Cash Deposit::CASH::::0::250795963036.Thank you for using MTN MobileMoney.*EN#,,200000,Incoming Money
06/05/2024,*113*R*A bank deposit of 5000 RWF has been added to your mobile money account at 2024-06-05 18:07:08. Your NEW BALANCE :205830 RWF. Cash Deposit::CASH::::0::250795963036.Thank you for using MTN MobileMoney.*EN#,,5000,Incoming Money
06/05/2024,"*165*S*200000 RWF transferred to Jane Smith (250791666666) from 36521838 at 2024-06-05 18:07:34 . Fee was: 1500 RWF. New balance: 4330 RWF. Kugura ama inite cg interineti kuri MoMo, Kanda *182*2*1# .*EN#",,200000,Transfers to Mobile Numbers
06/05/2024,"*165*S*2000 RWF transferred to Robert Brown (250791666666) from 36521838 at 2024-06-05 18:29:19 . Fee was: 100 RWF. New balance: 2230 RWF. Kugura ama inite cg interineti kuri MoMo, Kanda *182*2*1# .*EN#",,2000,Transfers to Mobile Numbers
06/05/2024,"TxId: 19727516208. Your payment of 600 RWF to Linda Green 76533 has been completed at 2024-06-05 22:17:21. Your new balance: 1,630 RWF. Fee was 0 RWF.Kanda*182*16# wiyandikishe muri poromosiyo ya BivaMoMotima, ugire amahirwe yo gutsindira ibihembo bishimishije.",19727516208,600,Payments to Code Holders
06/06/2024,*113*R*A bank deposit of 5000 RWF has been added to your mobile money account at 2024-06-06 08:18:21. Your NEW BALANCE :6630 RWF. Cash Deposit::CASH::::0::250795963036.Thank you for using MTN MobileMoney.*EN#,,5000,Incoming Money
06/06/2024,"*165*S*2000 RWF transferred to Jane Smith (250788999999) from 36521838 at 2024-06-06 08:18:49 . Fee was: 100 RWF. New balance: 4530 RWF. Kugura ama inite cg interineti kuri MoMo, Kanda *182*2*1# .*EN#",,2000,Transfers to Mobile Numbers
06/06/2024,"*165*S*2000 RWF transferred to Jane Smith (250790777777) from 36521838 at 2024-06-06 09:57:28 . Fee was: 100 RWF. New balance: 2430 RWF. Kugura ama inite cg interineti kuri MoMo, Kanda *182*2*1# .*EN#",,2000,Transfers to Mobile Numbers
06/06/2024,"*165*S*1500 RWF transferred to Robert Brown (250790777777) from 36521838 at 2024-06-06 13:54:42 . Fee was: 100 RWF. New balance: 830 RWF. Kugura ama inite cg interineti kuri MoMo, Kanda *182*2*1# .*EN#",,1500,Transfers to Mobile Numbers
06/06/2024,"*164*S*Y'ello,A transaction of 600 RWF by INFORMATION TECHNOLOGY  ENGINEERING CONSTRUCTION   ITEC Ltd on your MOMO account was successfully completed at 2024-06-06 16:19:01. Message from debit receiver: ITEC Pay. Your new balance:230 RWF. Fee was 0 RWF. Financial Transaction Id: 14262449979. External Transaction Id: c5e8bfeb-33d8-4eb2-8d22-154e5ff5e310.*EN#",,600,Transfers to Mobile Numbers
06/06/2024,*113*R*A bank deposit of 5000 RWF has been added to your mobile money account at 2024-06-06 17:56:07. Your NEW BALANCE :5230 RWF. Cash Deposit::CASH::::0::250795963036.Thank you for using MTN MobileMoney.*EN#,,5000,Incoming Money
06/06/2024,"*165*S*1500 RWF transferred to Alex Doe (250789888888) from 36521838 at 2024-06-06 18:06:14 . Fee was: 100 RWF. New balance: 3630 RWF. Kugura ama inite cg interineti kuri MoMo, Kanda *182*2*1# .*EN#",,1500,Transfers to Mobile Numbers
06/06/2024,"TxId: 36046721654. Your payment of 800 RWF to Robert Brown 84176 has been completed at 2024-06-06 18:18:56. Your new balance: 2,830 RWF. Fee was 0 RWF.Kanda*182*16# wiyandikishe muri poromosiyo ya BivaMoMotima, ugire amahirwe yo gutsindira ibihembo bishimishije.",36046721654,800,Payments to Code Holders
06/06/2024,*162*TxId:14264876273*S*Your payment of 2000 RWF to MTN Cash Power with token 06476-53398-98517-06704 has been completed at 2024-06-06 18:34:13. Fee was 0 RWF. Your new balance: 830 RWF . Message: - -. *EN#,,2000,Payments to Code Holders
06/07/2024,*113*R*A bank deposit of 5000 RWF has been added to your mobile money account at 2024-06-07 07:52:17. Your NEW BALANCE :5830 RWF. Cash Deposit::CASH::::0::250795963036.Thank you for using MTN MobileMoney.*EN#,,5000,Incoming Money
06/07/2024,"*165*S*500 RWF transferred to Samuel Carter (250790777777) from 36521838 at 2024-06-07 07:52:59 . Fee was: 20 RWF. New balance: 5310 RWF. Kugura ama inite cg interineti kuri MoMo, Kanda *182*2*1# .*EN#",,500,Transfers to Mobile Numbers
06/07/2024,You have received 12000 RWF from Alex Doe (*********612) on your mobile money account at 2024-06-07 16:08:33. Message from sender: . Your new balance:17310 RWF. Financial Transaction Id: 41002852845.,,12000,Incoming Money
06/07/2024,"*165*S*400 RWF transferred to Robert Brown (250788999999) from 36521838 at 2024-06-07 16:51:27 . Fee was: 20 RWF. New balance: 16890 RWF. Kugura ama inite cg interineti kuri MoMo, Kanda *182*2*1# .*EN#",,400,Transfers to Mobile Numbers
06/07/2024,"*165*S*1000 RWF transferred to Linda Green (250788999999) from 36521838 at 2024-06-07 17:29:00 . Fee was: 20 RWF. New balance: 15870 RWF. Kugura ama inite cg interineti kuri MoMo, Kanda *182*2*1# .*EN#",,1000,Transfers to Mobile Numbers
06/07/2024,"*165*S*1500 RWF transferred to Robert Brown (250789888888) from 36521838 at 2024-06-07 20:08:37 . Fee was: 100 RWF. New balance: 14270 RWF. Kugura ama inite cg interineti kuri MoMo, Kanda *182*2*1# .*EN#",,1500,Transfers to Mobile Numbers
06/07/2024,"*165*S*8000 RWF transferred to Jane Smith (250790777777) from 36521838 at 2024-06-07 20:36:44 . Fee was: 100 RWF. New balance: 6170 RWF. Kugura ama inite cg interineti kuri MoMo, Kanda *182*2*1# .*EN#",,8000,Transfers to Mobile Numbers
06/07/2024,"*165*S*800 RWF transferred to Linda Green (250788999999) from 36521838 at 2024-06-07 20:42:24 . Fee was: 20 RWF. New balance: 5350 RWF. Kugura ama inite cg interineti kuri MoMo, Kanda *182*2*1# .*EN#",,800,Transfers to Mobile Numbers
06/09/2024,*162*TxId:14303889432*S*Your payment of 2000 RWF to Airtime with token  has been completed at 2024-06-09 14:58:25. Fee was 0 RWF. Your new balance: 3350 RWF . Message: - -. *EN#,,2000,Payments to Code Holders
06/09/2024,*162*TxId:14304661948*S*Your payment of 1000 RWF to Airtime with token  has been completed at 2024-06-09 15:58:28. Fee was 0 RWF. Your new balance: 2350 RWF . Message: - -. *EN#,,1000,Payments to Code Holders
06/11/2024,"Yello!Umaze kugura 2000Rwf(1GB)/30days igura 2,000 RWF",,"2,000",Internet and Voice Bundle Purchases
06/11/2024,*162*TxId:14324965479*S*Your payment of 2000 RWF to Bundles and Packs with token  has been completed at 2024-06-11 06:26:11. Fee was 0 RWF. Your new balance: 350 RWF . Message: - -. *EN#,,2000,Payments to Code Holders
06/11/2024,*113*R*A bank deposit of 5000 RWF has been added to your mobile money account at 2024-06-11 07:51:04. Your NEW BALANCE :5350 RWF. Cash Deposit::CASH::::0::250795963036.Thank you for using MTN MobileMoney.*EN#,,5000,Incoming Money
06/11/2024,"*165*S*1000 RWF transferred to Robert Brown (250790777777) from 36521838 at 2024-06-11 07:52:49 . Fee was: 20 RWF. New balance: 4330 RWF. Kugura ama inite cg interineti kuri MoMo, Kanda *182*2*1# .*EN#",,1000,Transfers to Mobile Numbers
06/11/2024,"*165*S*1500 RWF transferred to Samuel Carter (250789888888) from 36521838 at 2024-06-11 08:36:42 . Fee was: 100 RWF. New balance: 2730 RWF. Kugura ama inite cg interineti kuri MoMo, Kanda *182*2*1# .*EN#",,1500,Transfers to Mobile Numbers
06/11/2024,"*165*S*2000 RWF transferred to Jane Smith (250790777777) from 36521838 at 2024-06-11 09:47:27 . Fee was: 100 RWF. New balance: 630 RWF. Kugura ama inite cg interineti kuri MoMo, Kanda *182*2*1# .*EN#",,2000,Transfers to Mobile Numbers
06/11/2024,"*165*S*500 RWF transferred to Samuel Carter (250789888888) from 36521838 at 2024-06-11 14:05:01 . Fee was: 20 RWF. New balance: 110 RWF. Kugura ama inite cg interineti kuri MoMo, Kanda *182*2*1# .*EN#",,500,Transfers to Mobile Numbers
06/11/2024,*113*R*A bank deposit of 5000 RWF has been added to your mobile money account at 2024-06-11 16:57:52. Your NEW BALANCE :5110 RWF. Cash Deposit::CASH::::0::250795963036.Thank you for using MTN MobileMoney.*EN#,,5000,Incoming Money
06/11/2024,"*165*S*1700 RWF transferred to Alex Doe (250790777777) from 36521838 at 2024-06-11 17:03:44 . Fee was: 100 RWF. New balance: 3310 RWF. Kugura ama inite cg interineti kuri MoMo, Kanda *182*2*1# .*EN#",,1700,Transfers to Mobile Numbers
06/12/2024,"*165*S*2000 RWF transferred to Robert Brown (250788999999) from 36521838 at 2024-06-12 09:24:17 . Fee was: 100 RWF. New balance: 1210 RWF. Kugura ama inite cg interineti kuri MoMo, Kanda *182*2*1# .*EN#",,2000,Transfers to Mobile Numbers
06/12/2024,*113*R*A bank deposit of 5000 RWF has been added to your mobile money account at 2024-06-12 13:04:27. Your NEW BALANCE :6210 RWF. Cash Deposit::CASH::::0::250795963036.Thank you for using MTN MobileMoney.*EN#,,5000,Incoming Money
06/12/2024,"TxId: 94257743617. Your payment of 3,500 RWF to Robert Brown 39208 has been completed at 2024-06-12 13:04:58. Your new balance: 2,710 RWF. Fee was 0 RWF.Kanda*182*16# wiyandikishe muri poromosiyo ya BivaMoMotima, ugire amahirwe yo gutsindira ibihembo bishimishije.",94257743617,"3,500",Payments to Code Holders
06/12/2024,"*165*S*1500 RWF transferred to Alex Doe (250789888888) from 36521838 at 2024-06-12 13:21:47 . Fee was: 100 RWF. New balance: 1110 RWF. Kugura ama inite cg interineti kuri MoMo, Kanda *182*2*1# .*EN#",,1500,Transfers to Mobile Numbers
06/12/2024,*113*R*A bank deposit of 5000 RWF has been added to your mobile money account at 2024-06-12 17:03:05. Your NEW BALANCE :6110 RWF. Cash Deposit::CASH::::0::250795963036.Thank you for using MTN MobileMoney.*EN#,,5000,Incoming Money
06/12/2024,"TxId: 28563784569. Your payment of 1,500 RWF to Alex Doe 39288 has been completed at 2024-06-12 17:08:44. Your new balance: 4,610 RWF. Fee was 0 RWF.Kanda*182*16# wiyandikishe muri poromosiyo ya BivaMoMotima, ugire amahirwe yo gutsindira ibihembo bishimishije.",28563784569,"1,500",Payments to Code Holders
06/12/2024,"TxId: 16877151789. Your payment of 1,500 RWF to Alex Doe 44082 has been completed at 2024-06-12 17:15:15. Your new balance: 3,110 RWF. Fee was 0 RWF.Kanda*182*16# wiyandikishe muri poromosiyo ya BivaMoMotima, ugire amahirwe yo gutsindira ibihembo bishimishije.",16877151789,"1,500",Payments to Code Holders
06/12/2024,*113*R*A bank deposit of 10000 RWF has been added to your mobile money account at 2024-06-12 17:42:10. Your NEW BALANCE :13110 RWF. Cash Deposit::CASH::::0::250795963036.Thank you for using MTN MobileMoney.*EN#,,10000,Incoming Money
06/12/2024,"*165*S*500 RWF transferred to Linda Green (250788999999) from 36521838 at 2024-06-12 17:47:49 . Fee was: 20 RWF. New balance: 12590 RWF. Kugura ama inite cg interineti kuri MoMo, Kanda *182*2*1# .*EN#",,500,Transfers to Mobile Numbers
06/12/2024,"*165*S*5000 RWF transferred to Linda Green (250790777777) from 36521838 at 2024-06-12 17:51:31 . Fee was: 100 RWF. New balance: 7490 RWF. Kugura ama inite cg interineti kuri MoMo, Kanda *182*2*1# .*EN#",,5000,Transfers to Mobile Numbers
06/12/2024,"*165*S*1000 RWF transferred to Alex Doe (250791666666) from 36521838 at 2024-06-12 17:52:30 . Fee was: 20 RWF. New balance: 6470 RWF. Kugura ama inite cg interineti kuri MoMo, Kanda *182*2*1# .*EN#",,1000,Transfers to Mobile Numbers
06/12/2024,"TxId: 49766645414. Your payment of 800 RWF to Linda Green 18881 has been completed at 2024-06-12 20:18:40. Your new balance: 5,670 RWF. Fee was 0 RWF.Kanda*182*16# wiyandikishe muri poromosiyo ya BivaMoMotima, ugire amahirwe yo gutsindira ibihembo bishimishije.",49766645414,800,Payments to Code Holders
06/12/2024,"TxId: 91799715733. Your payment of 1,000 RWF to Samuel Carter 70871 has been completed at 2024-06-12 22:08:07. Your new balance: 4,670 RWF. Fee was 0 RWF.Kanda*182*16# wiyandikishe muri poromosiyo ya BivaMoMotima, ugire amahirwe yo gutsindira ibihembo bishimishije.",91799715733,"1,000",Payments to Code Holders
06/12/2024,"TxId: 42326639460. Your payment of 1,600 RWF to Jane Smith 37496 has been completed at 2024-06-12 22:24:34. Your new balance: 3,070 RWF. Fee was 0 RWF.Kanda*182*16# wiyandikishe muri poromosiyo ya BivaMoMotima, ugire amahirwe yo gutsindira ibihembo bishimishije.",42326639460,"1,600",Payments to Code Holders
06/13/2024,"*165*S*1000 RWF transferred to Jane Smith (250789888888) from 36521838 at 2024-06-13 09:22:59 . Fee was: 20 RWF. New balance: 2050 RWF. Kugura ama inite cg interineti kuri MoMo, Kanda *182*2*1# .*EN#",,1000,Transfers to Mobile Numbers
06/13/2024,"*165*S*1800 RWF transferred to Robert Brown (250791666666) from 36521838 at 2024-06-13 09:51:51 . Fee was: 100 RWF. New balance: 150 RWF. Kugura ama inite cg interineti kuri MoMo, Kanda *182*2*1# .*EN#",,1800,Transfers to Mobile Numbers
06/13/2024,*113*R*A bank deposit of 5000 RWF has been added to your mobile money account at 2024-06-13 13:35:40. Your NEW BALANCE :5150 RWF. Cash Deposit::CASH::::0::250795963036.Thank you for using MTN MobileMoney.*EN#,,5000,Incoming Money
06/13/2024,"TxId: 18893569803. Your payment of 1,500 RWF to Alex Doe 45991 has been completed at 2024-06-13 13:36:25. Your new balance: 3,650 RWF. Fee was 0 RWF.Kanda*182*16# wiyandikishe muri poromosiyo ya BivaMoMotima, ugire amahirwe yo gutsindira ibihembo bishimishije.",18893569803,"1,500",Payments to Code Holders
06/13/2024,"*165*S*1700 RWF transferred to Robert Brown (250789888888) from 36521838 at 2024-06-13 18:13:31 . Fee was: 100 RWF. New balance: 1850 RWF. Kugura ama inite cg interineti kuri MoMo, Kanda *182*2*1# .*EN#",,1700,Transfers to Mobile Numbers
06/13/2024,*113*R*A bank deposit of 10000 RWF has been added to your mobile money account at 2024-06-13 18:24:09. Your NEW BALANCE :11850 RWF. Cash Deposit::CASH::::0::250795963036.Thank you for using MTN MobileMoney.*EN#,,10000,Incoming Money
06/13/2024,"*165*S*7000 RWF transferred to Samuel Carter (250788999999) from 36521838 at 2024-06-13 18:26:07 . Fee was: 100 RWF. New balance: 4750 RWF. Kugura ama inite cg interineti kuri MoMo, Kanda *182*2*1# .*EN#",,7000,Transfers to Mobile Numbers
06/14/2024,*113*R*A bank deposit of 25000 RWF has been added to your mobile money account at 2024-06-14 07:49:33. Your NEW BALANCE :29750 RWF. Cash Deposit::CASH::::0::250795963036.Thank you for using MTN MobileMoney.*EN#,,25000,Incoming Money
06/14/2024,"*164*S*Y'ello,A transaction of 25000 RWF by DIRECT PAYMENT LTD  on your MOMO account was successfully completed at 2024-06-14 07:52:10. Message from debit receiver: . Your new balance:4750 RWF. Fee was 0 RWF. Financial Transaction Id: 14366722236. External Transaction Id: 48214394.*EN#",,25000,Transfers to Mobile Numbers
06/14/2024,"TxId: 10809435113. Your payment of 2,000 RWF to Linda Green 84094 has been completed at 2024-06-14 09:44:21. Your new balance: 2,750 RWF. Fee was 0 RWF.Kanda*182*16# wiyandikishe muri poromosiyo ya BivaMoMotima, ugire amahirwe yo gutsindira ibihembo bishimishije.",10809435113,"2,000",Payments to Code Holders
06/14/2024,"TxId: 97328486237. Your payment of 1,800 RWF to Samuel Carter 31469 has been completed at 2024-06-14 10:58:00. Your new balance: 950 RWF. Fee was 0 RWF.Kanda*182*16# wiyandikishe muri poromosiyo ya BivaMoMotima, ugire amahirwe yo gutsindira ibihembo bishimishije.",97328486237,"1,800",Payments to Code Holders
06/14/2024,*113*R*A bank deposit of 5000 RWF has been added to your mobile money account at 2024-06-14 13:06:59. Your NEW BALANCE :5950 RWF. Cash Deposit::CASH::::0::250795963036.Thank you for using MTN MobileMoney.*EN#,,5000,Incoming Money
06/14/2024,"TxId: 20564153955. Your payment of 2,500 RWF to Alex Doe 15064 has been completed at 2024-06-14 13:07:42. Your new balance: 3,450 RWF. Fee was 0 RWF.Kanda*182*16# wiyandikishe muri poromosiyo ya BivaMoMotima, ugire amahirwe yo gutsindira ibihembo bishimishije.",20564153955,"2,500",Payments to Code Holders
06/14/2024,"TxId: 31051483102. Your payment of 1,500 RWF to Samuel Carter 28053 has been completed at 2024-06-14 13:28:42. Your new balance: 1,950 RWF. Fee was 0 RWF.Kanda*182*16# wiyandikishe muri poromosiyo ya BivaMoMotima, ugire amahirwe yo gutsindira ibihembo bishimishije.",31051483102,"1,500",Payments to Code Holders
06/14/2024,*113*R*A bank deposit of 15000 RWF has been added to your mobile money account at 2024-06-14 13:56:53. Your NEW BALANCE :16950 RWF. Cash Deposit::CASH::::0::250795963036.Thank you for using MTN MobileMoney.*EN#,,15000,Incoming Money
06/14/2024,"*165*S*10000 RWF transferred to Robert Brown (250791666666) from 36521838 at 2024-06-14 13:57:25 . Fee was: 100 RWF. New balance: 6850 RWF. Kugura ama inite cg interineti kuri MoMo, Kanda *182*2*1# .*EN#",,10000,Transfers to Mobile Numbers
06/14/2024,"TxId: 17481776844. Your payment of 1,800 RWF to Robert Brown 40227 has been completed at 2024-06-14 15:52:21. Your new balance: 5,050 RWF. Fee was 0 RWF.Kanda*182*16# wiyandikishe muri poromosiyo ya BivaMoMotima, ugire amahirwe yo gutsindira ibihembo bishimishije.",17481776844,"1,800",Payments to Code Holders
06/14/2024,"*165*S*200 RWF transferred to Alex Doe (250790777777) from 36521838 at 2024-06-14 17:23:57 . Fee was: 20 RWF. New balance: 4830 RWF. Kugura ama inite cg interineti kuri MoMo, Kanda *182*2*1# .*EN#",,200,Transfers to Mobile Numbers
06/14/2024,"TxId: 63344530197. Your payment of 1,000 RWF to Robert Brown 18321 has been completed at 2024-06-14 20:04:10. Your new balance: 3,830 RWF. Fee was 0 RWF.Kanda*182*16# wiyandikishe muri poromosiyo ya BivaMoMotima, ugire amahirwe yo gutsindira ibihembo bishimishije.",63344530197,"1,000",Payments to Code Holders
06/14/2024,"*165*S*1500 RWF transferred to Jane Smith (250790777777) from 36521838 at 2024-06-14 20:37:49 . Fee was: 100 RWF. New balance: 2230 RWF. Kugura ama inite cg interineti kuri MoMo, Kanda *182*2*1# .*EN#",,1500,Transfers to Mobile Numbers
06/14/2024,"*165*S*1800 RWF transferred to Linda Green (250791666666) from 36521838 at 2024-06-14 20:38:41 . Fee was: 100 RWF. New balance: 330 RWF. Kugura ama inite cg interineti kuri MoMo, Kanda *182*2*1# .*EN#",,1800,Transfers to Mobile Numbers
06/14/2024,*113*R*A bank deposit of 8000 RWF has been added to your mobile money account at 2024-06-14 21:54:38. Your NEW BALANCE :8330 RWF. Cash Deposit::CASH::::0::250795963036.Thank you for using MTN MobileMoney.*EN#,,8000,Incoming Money
06/14/2024,"*165*S*2000 RWF transferred to Robert Brown (250791666666) from 36521838 at 2024-06-14 23:17:17 . Fee was: 100 RWF. New balance: 6230 RWF. Kugura ama inite cg interineti kuri MoMo, Kanda *182*2*1# .*EN#",,2000,Transfers to Mobile Numbers
06/15/2024,"TxId: 99134996997. Your payment of 1,500 RWF to Jane Smith 89064 has been completed at 2024-06-15 13:11:40. Your new balance: 4,730 RWF. Fee was 0 RWF.Kanda*182*16# wiyandikishe muri poromosiyo ya BivaMoMotima, ugire amahirwe yo gutsindira ibihembo bishimishije.",99134996997,"1,500",Payments to Code Holders
06/15/2024,"*165*S*1500 RWF transferred to Jane Smith (250790777777) from 36521838 at 2024-06-15 13:12:13 . Fee was: 100 RWF. New balance: 3130 RWF. Kugura ama inite cg interineti kuri MoMo, Kanda *182*2*1# .*EN#",,1500,Transfers to Mobile Numbers
06/15/2024,"TxId: 96723699988. Your payment of 2,100 RWF to Jane Smith 92936 has been completed at 2024-06-15 13:20:08. Your new balance: 1,030 RWF. Fee was 0 RWF.Kanda*182*16# wiyandikishe muri poromosiyo ya BivaMoMotima, ugire amahirwe yo gutsindira ibihembo bishimishije.",96723699988,"2,100",Payments to Code Holders
06/15/2024,*113*R*A bank deposit of 50000 RWF has been added to your mobile money account at 2024-06-15 14:00:04. Your NEW BALANCE :51030 RWF. Cash Deposit::CASH::::0::250795963036.Thank you for using MTN MobileMoney.*EN#,,50000,Incoming Money
06/15/2024,"*165*S*700 RWF transferred to Robert Brown (250791666666) from 36521838 at 2024-06-15 14:02:22 . Fee was: 20 RWF. New balance: 50310 RWF. Kugura ama inite cg interineti kuri MoMo, Kanda *182*2*1# .*EN#",,700,Transfers to Mobile Numbers
06/15/2024,"TxId: 16545003631. Your payment of 700 RWF to Alex Doe 29114 has been completed at 2024-06-15 14:02:58. Your new balance: 49,610 RWF. Fee was 0 RWF.Kanda*182*16# wiyandikishe muri poromosiyo ya BivaMoMotima, ugire amahirwe yo gutsindira ibihembo bishimishije.",16545003631,700,Payments to Code Holders
06/15/2024,"TxId: 61557468875. Your payment of 23,300 RWF to Jane Smith 90360 has been completed at 2024-06-15 15:37:37. Your new balance: 26,310 RWF. Fee was 0 RWF.Kanda*182*16# wiyandikishe muri poromosiyo ya BivaMoMotima, ugire amahirwe yo gutsindira ibihembo bishimishije.",61557468875,"23,300",Payments to Code Holders
06/15/2024,"*165*S*1500 RWF transferred to Robert Brown (250789888888) from 36521838 at 2024-06-15 16:44:21 . Fee was: 100 RWF. New balance: 24710 RWF. Kugura ama inite cg interineti kuri MoMo, Kanda *182*2*1# .*EN#",,1500,Transfers to Mobile Numbers
06/15/2024,"*165*S*1500 RWF transferred to Samuel Carter (250791666666) from 36521838 at 2024-06-15 16:44:59 . Fee was: 100 RWF. New balance: 23110 RWF. Kugura ama inite cg interineti kuri MoMo, Kanda *182*2*1# .*EN#",,1500,Transfers to Mobile Numbers
06/15/2024,"TxId: 81945111303. Your payment of 11,000 RWF to Alex Doe 15688 has been completed at 2024-06-15 18:30:24. Your new balance: 12,110 RWF. Fee was 0 RWF.Kanda*182*16# wiyandikishe muri poromosiyo ya BivaMoMotima, ugire amahirwe yo gutsindira ibihembo bishimishije.",81945111303,"11,000",Payments to Code Holders
06/15/2024,"*164*S*Y'ello,A transaction of 8000 RWF by ESICIA LTD KPAY on your MOMO account was successfully completed at 2024-06-15 21:28:58. Message from debit receiver: 1599236171847972758074646. Your new balance:4110 RWF. Fee was 0 RWF. Financial Transaction Id: 14392932831. External Transaction Id: E39762254KPY1718479727.*EN#",,8000,Transfers to Mobile Numbers
06/16/2024,"TxId: 59979980024. Your payment of 900 RWF to Robert Brown 32983 has been completed at 2024-06-16 12:28:56. Your new balance: 3,210 RWF. Fee was 0 RWF.Kanda*182*16# wiyandikishe muri poromosiyo ya BivaMoMotima, ugire amahirwe yo gutsindira ibihembo bishimishije.",59979980024,900,Payments to Code Holders
06/16/2024,"*165*S*800 RWF transferred to Samuel Carter (250791666666) from 36521838 at 2024-06-16 13:06:33 . Fee was: 20 RWF. New balance: 2390 RWF. Kugura ama inite cg interineti kuri MoMo, Kanda *182*2*1# .*EN#",,800,Transfers to Mobile Numbers
06/16/2024,"*165*S*800 RWF transferred to Samuel Carter (250788999999) from 36521838 at 2024-06-16 13:07:09 . Fee was: 20 RWF. New balance: 1570 RWF. Kugura ama inite cg interineti kuri MoMo, Kanda *182*2*1# .*EN#",,800,Transfers to Mobile Numbers
06/16/2024,*113*R*A bank deposit of 20000 RWF has been added to your mobile money account at 2024-06-16 13:20:31. Your NEW BALANCE :21570 RWF. Cash Deposit::CASH::::0::250795963036.Thank you for using MTN MobileMoney.*EN#,,20000,Incoming Money
06/16/2024,"*165*S*2000 RWF transferred to Samuel Carter (250789888888) from 36521838 at 2024-06-16 13:21:07 . Fee was: 100 RWF. New balance: 19470 RWF. Kugura ama inite cg interineti kuri MoMo, Kanda *182*2*1# .*EN#",,2000,Transfers to Mobile Numbers
06/16/2024,"*165*S*4600 RWF transferred to Jane Smith (250790777777) from 36521838 at 2024-06-16 13:26:25 . Fee was: 100 RWF. New balance: 14770 RWF. Kugura ama inite cg interineti kuri MoMo, Kanda *182*2*1# .*EN#",,4600,Transfers to Mobile Numbers
06/16/2024,"*165*S*400 RWF transferred to Alex Doe (250789888888) from 36521838 at 2024-06-16 14:31:13 . Fee was: 20 RWF. New balance: 14350 RWF. Kugura ama inite cg interineti kuri MoMo, Kanda *182*2*1# .*EN#",,400,Transfers to Mobile Numbers
06/16/2024,"*164*S*Y'ello,A transaction of 5000 RWF by Future Dynamic  Innovations ltd on your MOMO account was successfully completed at 2024-06-16 19:25:44. Message from debit receiver: 610. Your new balance:9350 RWF. Fee was 0 RWF. Financial Transaction Id: 14404189056. External Transaction Id: 475e95b8a1d049c2ba9ee675401d9332.*EN#",,5000,Transfers to Mobile Numbers
06/16/2024,"TxId: 77021305535. Your payment of 7,000 RWF to Linda Green 89531 has been completed at 2024-06-16 20:13:42. Your new balance: 2,350 RWF. Fee was 0 RWF.Kanda*182*16# wiyandikishe muri poromosiyo ya BivaMoMotima, ugire amahirwe yo gutsindira ibihembo bishimishije.",77021305535,"7,000",Payments to Code Holders
06/16/2024,*162*TxId:14405681742*S*Your payment of 1000 RWF to MTN Cash Power with token 40296-92192-79801-46115 has been completed at 2024-06-16 21:05:53. Fee was 0 RWF. Your new balance: 1350 RWF . Message: - -. *EN#,,1000,Payments to Code Holders
06/16/2024,"TxId: 59491550845. Your payment of 500 RWF to Samuel Carter 54211 has been completed at 2024-06-16 21:48:11. Your new balance: 850 RWF. Fee was 0 RWF.Kanda*182*16# wiyandikishe muri poromosiyo ya BivaMoMotima, ugire amahirwe yo gutsindira ibihembo bishimishije.",59491550845,500,Payments to Code Holders
06/16/2024,"*165*S*500 RWF transferred to Linda Green (250788999999) from 36521838 at 2024-06-16 21:54:00 . Fee was: 20 RWF. New balance: 330 RWF. Kugura ama inite cg interineti kuri MoMo, Kanda *182*2*1# .*EN#",,500,Transfers to Mobile Numbers
06/17/2024,*162*TxId:14412904724*S*Your payment of 200 RWF to Airtime with token  has been completed at 2024-06-17 14:57:47. Fee was 0 RWF. Your new balance: 130 RWF . Message: - -. *EN#,,200,Payments to Code Holders
06/17/2024,*113*R*A bank deposit of 20000 RWF has been added to your mobile money account at 2024-06-17 15:01:29. Your NEW BALANCE :20130 RWF. Cash Deposit::CASH::::0::250795963036.Thank you for using MTN MobileMoney.*EN#,,20000,Incoming Money
06/17/2024,*162*TxId:14413610551*S*Your payment of 5000 RWF to Airtime with token  has been completed at 2024-06-17 15:54:55. Fee was 0 RWF. Your new balance: 15130 RWF . Message: - -. *EN#,,5000,Payments to Code Holders
06/17/2024,"TxId: 19524019964. Your payment of 4,500 RWF to Linda Green 22964 has been completed at 2024-06-17 15:57:16. Your new balance: 10,630 RWF. Fee was 0 RWF.Kanda*182*16# wiyandikishe muri poromosiyo ya BivaMoMotima, ugire amahirwe yo gutsindira ibihembo bishimishije.",19524019964,"4,500",Payments to Code Holders
06/17/2024,"*165*S*4550 RWF transferred to Linda Green (250789888888) from 36521838 at 2024-06-17 16:16:56 . Fee was: 100 RWF. New balance: 5980 RWF. Kugura ama inite cg interineti kuri MoMo, Kanda *182*2*1# .*EN#",,4550,Transfers to Mobile Numbers
06/17/2024,"*165*S*3000 RWF transferred to Samuel Carter (250790777777) from 36521838 at 2024-06-17 16:20:20 . Fee was: 100 RWF. New balance: 2880 RWF. Kugura ama inite cg interineti kuri MoMo, Kanda *182*2*1# .*EN#",,3000,Transfers to Mobile Numbers
06/17/2024,*113*R*A bank deposit of 50000 RWF has been added to your mobile money account at 2024-06-17 16:26:27. Your NEW BALANCE :52880 RWF. Cash Deposit::CASH::::0::250795963036.Thank you for using MTN MobileMoney.*EN#,,50000,Incoming Money
06/17/2024,"TxId: 23764987164. Your payment of 9,900 RWF to Linda Green 57394 has been completed at 2024-06-17 16:27:00. Your new balance: 42,980 RWF. Fee was 0 RWF.Kanda*182*16# wiyandikishe muri poromosiyo ya BivaMoMotima, ugire amahirwe yo gutsindira ibihembo bishimishije.",23764987164,"9,900",Payments to Code Holders
06/17/2024,"TxId: 41741931224. Your payment of 2,800 RWF to Jane Smith 12146 has been completed at 2024-06-17 16:35:20. Your new balance: 40,180 RWF. Fee was 0 RWF.Kanda*182*16# wiyandikishe muri poromosiyo ya BivaMoMotima, ugire amahirwe yo gutsindira ibihembo bishimishije.",41741931224,"2,800",Payments to Code Holders
06/17/2024,"*165*S*30000 RWF transferred to Linda Green (250791666666) from 36521838 at 2024-06-17 17:04:58 . Fee was: 250 RWF. New balance: 9930 RWF. Kugura ama inite cg interineti kuri MoMo, Kanda *182*2*1# .*EN#",,30000,Transfers to Mobile Numbers
06/17/2024,"*165*S*500 RWF transferred to Robert Brown (250790777777) from 36521838 at 2024-06-17 18:51:05 . Fee was: 20 RWF. New balance: 9410 RWF. Kugura ama inite cg interineti kuri MoMo, Kanda *182*2*1# .*EN#",,500,Transfers to Mobile Numbers
06/17/2024,*113*R*A bank deposit of 20000 RWF has been added to your mobile money account at 2024-06-17 19:50:19. Your NEW BALANCE :29410 RWF. Cash Deposit::CASH::::0::250795963036.Thank you for using MTN MobileMoney.*EN#,,20000,Incoming Money
06/17/2024,"*165*S*10000 RWF transferred to Linda Green (250789888888) from 36521838 at 2024-06-17 19:50:46 . Fee was: 100 RWF. New balance: 19310 RWF. Kugura ama inite cg interineti kuri MoMo, Kanda *182*2*1# .*EN#",,10000,Transfers to Mobile Numbers
06/17/2024,"*165*S*2000 RWF transferred to Robert Brown (250790777777) from 36521838 at 2024-06-17 21:32:35 . Fee was: 100 RWF. New balance: 17210 RWF. Kugura ama inite cg interineti kuri MoMo, Kanda *182*2*1# .*EN#",,2000,Transfers to Mobile Numbers
06/17/2024,"TxId: 81779365319. Your payment of 2,000 RWF to Linda Green 31161 has been completed at 2024-06-17 22:14:09. Your new balance: 15,210 RWF. Fee was 0 RWF.Kanda*182*16# wiyandikishe muri poromosiyo ya BivaMoMotima, ugire amahirwe yo gutsindira ibihembo bishimishije.",81779365319,"2,000",Payments to Code Holders
06/18/2024,"*165*S*2000 RWF transferred to Jane Smith (250790777777) from 36521838 at 2024-06-18 09:08:49 . Fee was: 100 RWF. New balance: 13110 RWF. Kugura ama inite cg interineti kuri MoMo, Kanda *182*2*1# .*EN#",,2000,Transfers to Mobile Numbers
06/18/2024,"TxId: 12093489080. Your payment of 2,500 RWF to Alex Doe 12185 has been completed at 2024-06-18 13:32:45. Your new balance: 10,610 RWF. Fee was 0 RWF.Kanda*182*16# wiyandikishe muri poromosiyo ya BivaMoMotima, ugire amahirwe yo gutsindira ibihembo bishimishije.",12093489080,"2,500",Payments to Code Holders
06/18/2024,"TxId: 10919892030. Your payment of 1,500 RWF to Samuel Carter 54054 has been completed at 2024-06-18 13:47:33. Your new balance: 9,110 RWF. Fee was 0 RWF.Kanda*182*16# wiyandikishe muri poromosiyo ya BivaMoMotima, ugire amahirwe yo gutsindira ibihembo bishimishije.",10919892030,"1,500",Payments to Code Holders
06/18/2024,You have received 5000 RWF from Linda Green (*********806) on your mobile money account at 2024-06-18 14:08:05. Message from sender: . Your new balance:14110 RWF. Financial Transaction Id: 43960900475.,,5000,Incoming Money
06/18/2024,"*165*S*1700 RWF transferred to Robert Brown (250789888888) from 36521838 at 2024-06-18 18:39:24 . Fee was: 100 RWF. New balance: 12310 RWF. Kugura ama inite cg interineti kuri MoMo, Kanda *182*2*1# .*EN#",,1700,Transfers to Mobile Numbers
06/18/2024,"TxId: 92393353015. Your payment of 1,500 RWF to Alex Doe 12474 has been completed at 2024-06-18 20:13:38. Your new balance: 10,810 RWF. Fee was 0 RWF.Kanda*182*16# wiyandikishe muri poromosiyo ya BivaMoMotima, ugire amahirwe yo gutsindira ibihembo bishimishije.",92393353015,"1,500",Payments to Code Holders
06/19/2024,"TxId: 70015105006. Your payment of 3,500 RWF to Robert Brown 29936 has been completed at 2024-06-19 13:14:56. Your new balance: 7,310 RWF. Fee was 0 RWF.Kanda*182*16# wiyandikishe muri poromosiyo ya BivaMoMotima, ugire amahirwe yo gutsindira ibihembo bishimishije.",70015105006,"3,500",Payments to Code Holders
06/19/2024,"TxId: 11901062453. Your payment of 1,500 RWF to Samuel Carter 20955 has been completed at 2024-06-19 16:07:43. Your new balance: 5,810 RWF. Fee was 0 RWF.Kanda*182*16# wiyandikishe muri poromosiyo ya BivaMoMotima, ugire amahirwe yo gutsindira ibihembo bishimishije.",11901062453,"1,500",Payments to Code Holders
06/19/2024,"Yello!Umaze kugura 2,000FRW(2GB) igura 2,000 RWF",,"2,000",Internet and Voice Bundle Purchases
06/19/2024,*162*TxId:14443130677*S*Your payment of 2000 RWF to Bundles and Packs with token  has been completed at 2024-06-19 18:15:53. Fee was 0 RWF. Your new balance: 3810 RWF . Message: - -. *EN#,,2000,Payments to Code Holders
06/19/2024,You have received 3700 RWF from Samuel Carter (*********090) on your mobile money account at 2024-06-19 20:26:00. Message from sender: . Your new balance:7510 RWF. Financial Transaction Id: 63115508240.,,3700,Incoming Money
06/19/2024,*113*R*A bank deposit of 10000 RWF has been added to your mobile money account at 2024-06-19 22:16:00. Your NEW BALANCE :17510 RWF. Cash Deposit::CASH::::0::250795963036.Thank you for using MTN MobileMoney.*EN#,,10000,Incoming Money
06/19/2024,"*165*S*12000 RWF transferred to Jane Smith (250788999999) from 36521838 at 2024-06-19 22:17:07 . Fee was: 250 RWF. New balance: 5260 RWF. Kugura ama inite cg interineti kuri MoMo, Kanda *182*2*1# .*EN#",,12000,Transfers to Mobile Numbers
06/20/2024,"*165*S*1500 RWF transferred to Robert Brown (250788999999) from 36521838 at 2024-06-20 17:55:45 . Fee was: 100 RWF. New balance: 3660 RWF. Kugura ama inite cg interineti kuri MoMo, Kanda *182*2*1# .*EN#",,1500,Transfers to Mobile Numbers
06/20/2024,"*165*S*1000 RWF transferred to Alex Doe (250788999999) from 36521838 at 2024-06-20 19:22:27 . Fee was: 20 RWF. New balance: 2640 RWF. Kugura ama inite cg interineti kuri MoMo, Kanda *182*2*1# .*EN#",,1000,Transfers to Mobile Numbers
06/21/2024,You have received 1500 RWF from Samuel Carter (*********612) on your mobile money account at 2024-06-21 13:44:47. Message from sender: . Your new balance:4140 RWF. Financial Transaction Id: 90311838363.,,1500,Incoming Money
06/21/2024,"TxId: 65472821949. Your payment of 1,500 RWF to Alex Doe 35808 has been completed at 2024-06-21 16:01:02. Your new balance: 2,640 RWF. Fee was 0 RWF.Kanda*182*16# wiyandikishe muri poromosiyo ya BivaMoMotima, ugire amahirwe yo gutsindira ibihembo bishimishije.",65472821949,"1,500",Payments to Code Holders
06/21/2024,*162*TxId:14469963984*S*Your payment of 2000 RWF to MTN Cash Power with token 09779-88882-62297-78749 has been completed at 2024-06-21 16:48:15. Fee was 0 RWF. Your new balance: 640 RWF . Message: - -. *EN#,,2000,Payments to Code Holders
06/21/2024,*113*R*A bank deposit of 10000 RWF has been added to your mobile money account at 2024-06-21 17:39:32. Your NEW BALANCE :10640 RWF. Cash Deposit::CASH::::0::250795963036.Thank you for using MTN MobileMoney.*EN#,,10000,Incoming Money
06/21/2024,"*165*S*5000 RWF transferred to Alex Doe (250789888888) from 36521838 at 2024-06-21 17:40:25 . Fee was: 100 RWF. New balance: 5540 RWF. Kugura ama inite cg interineti kuri MoMo, Kanda *182*2*1# .*EN#",,5000,Transfers to Mobile Numbers
06/21/2024,"TxId: 18526546570. Your payment of 1,000 RWF to Alex Doe 27861 has been completed at 2024-06-21 19:02:57. Your new balance: 4,540 RWF. Fee was 0 RWF.Kanda*182*16# wiyandikishe muri poromosiyo ya BivaMoMotima, ugire amahirwe yo gutsindira ibihembo bishimishije.",18526546570,"1,000",Payments to Code Holders
06/21/2024,"TxId: 90823104833. Your payment of 800 RWF to Jane Smith 90263 has been completed at 2024-06-21 21:08:17. Your new balance: 3,740 RWF. Fee was 0 RWF.Kanda*182*16# wiyandikishe muri poromosiyo ya BivaMoMotima, ugire amahirwe yo gutsindira ibihembo bishimishije.",90823104833,800,Payments to Code Holders
06/22/2024,"TxId: 94029377235. Your payment of 2,500 RWF to Alex Doe 38221 has been completed at 2024-06-22 06:14:50. Your new balance: 1,240 RWF. Fee was 0 RWF.Kanda*182*16# wiyandikishe muri poromosiyo ya BivaMoMotima, ugire amahirwe yo gutsindira ibihembo bishimishije.",94029377235,"2,500",Payments to Code Holders
06/22/2024,*113*R*A bank deposit of 5000 RWF has been added to your mobile money account at 2024-06-22 10:10:55. Your NEW BALANCE :6240 RWF. Cash Deposit::CASH::::0::250795963036.Thank you for using MTN MobileMoney.*EN#,,5000,Incoming Money
06/22/2024,"*165*S*1200 RWF transferred to Alex Doe (250791666666) from 36521838 at 2024-06-22 10:13:03 . Fee was: 100 RWF. New balance: 4940 RWF. Kugura ama inite cg interineti kuri MoMo, Kanda *182*2*1# .*EN#",,1200,Transfers to Mobile Numbers
06/22/2024,"TxId: 38074910818. Your payment of 6,200 RWF to Linda Green 39756 has been completed at 2024-06-22 10:49:01. Your new balance: 8,740 RWF. Fee was 0 RWF.Kanda*182*16# wiyandikishe muri poromosiyo ya BivaMoMotima, ugire amahirwe yo gutsindira ibihembo bishimishije.",38074910818,"6,200",Payments to Code Holders
06/22/2024,*113*R*A bank deposit of 10000 RWF has been added to your mobile money account at 2024-06-22 10:48:17. Your NEW BALANCE :14940 RWF. Cash Deposit::CASH::::0::250795963036.Thank you for using MTN MobileMoney.*EN#,,10000,Incoming Money
06/22/2024,"*165*S*1000 RWF transferred to Samuel Carter (250788999999) from 36521838 at 2024-06-22 11:34:08 . Fee was: 20 RWF. New balance: 7720 RWF. Kugura ama inite cg interineti kuri MoMo, Kanda *182*2*1# .*EN#",,1000,Transfers to Mobile Numbers
06/22/2024,"TxId: 43333418094. Your payment of 1,500 RWF to Alex Doe 29218 has been completed at 2024-06-22 11:40:56. Your new balance: 6,220 RWF. Fee was 0 RWF.Kanda*182*16# wiyandikishe muri poromosiyo ya BivaMoMotima, ugire amahirwe yo gutsindira ibihembo bishimishije.",43333418094,"1,500",Payments to Code Holders
06/22/2024,*113*R*A bank deposit of 20000 RWF has been added to your mobile money account at 2024-06-22 18:15:11. Your NEW BALANCE :26220 RWF. Cash Deposit::CASH::::0::250795963036.Thank you for using MTN MobileMoney.*EN#,,20000,Incoming Money
06/22/2024,"TxId: 43349533054. Your payment of 10,000 RWF to Samuel Carter 44047 has been completed at 2024-06-22 18:15:44. Your new balance: 16,220 RWF. Fee was 0 RWF.Kanda*182*16# wiyandikishe muri poromosiyo ya BivaMoMotima, ugire amahirwe yo gutsindira ibihembo bishimishije.",43349533054,"10,000",Payments to Code Holders
06/22/2024,"*165*S*2000 RWF transferred to Alex Doe (250789888888) from 36521838 at 2024-06-22 20:13:21 . Fee was: 100 RWF. New balance: 14120 RWF. Kugura ama inite cg interineti kuri MoMo, Kanda *182*2*1# .*EN#",,2000,Transfers to Mobile Numbers
06/23/2024,You have received 1500 RWF from Samuel Carter (*********711) on your mobile money account at 2024-06-23 12:15:45. Message from sender: . Your new balance:15620 RWF. Financial Transaction Id: 72288050689.,,1500,Incoming Money
06/23/2024,"TxId: 12723317674. Your payment of 15,000 RWF to Linda Green 94480 has been completed at 2024-06-23 12:16:52. Your new balance: 620 RWF. Fee was 0 RWF.Kanda*182*16# wiyandikishe muri poromosiyo ya BivaMoMotima, ugire amahirwe yo gutsindira ibihembo bishimishije.",12723317674,"15,000",Payments to Code Holders
06/23/2024,"TxId: 29081551536. Your payment of 600 RWF to Jane Smith 74631 has been completed at 2024-06-23 13:56:01. Your new balance: 20 RWF. Fee was 0 RWF.Kanda*182*16# wiyandikishe muri poromosiyo ya BivaMoMotima, ugire amahirwe yo gutsindira ibihembo bishimishije.",29081551536,600,Payments to Code Holders
06/23/2024,*113*R*A bank deposit of 20000 RWF has been added to your mobile money account at 2024-06-23 16:45:45. Your NEW BALANCE :20020 RWF. Cash Deposit::CASH::::0::250795963036.Thank you for using MTN MobileMoney.*EN#,,20000,Incoming Money
06/23/2024,"*165*S*8000 RWF transferred to Linda Green (250788999999) from 36521838 at 2024-06-23 16:47:04 . Fee was: 100 RWF. New balance: 11920 RWF. Kugura ama inite cg interineti kuri MoMo, Kanda *182*2*1# .*EN#",,8000,Transfers to Mobile Numbers
06/23/2024,"TxId: 55981011420. Your payment of 800 RWF to Jane Smith 67993 has been completed at 2024-06-23 17:02:22. Your new balance: 11,120 RWF. Fee was 0 RWF.Kanda*182*16# wiyandikishe muri poromosiyo ya BivaMoMotima, ugire amahirwe yo gutsindira ibihembo bishimishije.",55981011420,800,Payments to Code Holders
06/23/2024,"*165*S*5000 RWF transferred to Linda Green (250789888888) from 36521838 at 2024-06-23 20:06:48 . Fee was: 100 RWF. New balance: 6020 RWF. Kugura ama inite cg interineti kuri MoMo, Kanda *182*2*1# .*EN#",,5000,Transfers to Mobile Numbers
06/24/2024,"*165*S*2000 RWF transferred to Jane Smith (250790777777) from 36521838 at 2024-06-24 10:37:14 . Fee was: 100 RWF. New balance: 3920 RWF. Kugura ama inite cg interineti kuri MoMo, Kanda *182*2*1# .*EN#",,2000,Transfers to Mobile Numbers
06/24/2024,"TxId: 67456128847. Your payment of 3,500 RWF to Jane Smith 19682 has been completed at 2024-06-24 13:06:23. Your new balance: 420 RWF. Fee was 0 RWF.Kanda*182*16# wiyandikishe muri poromosiyo ya BivaMoMotima, ugire amahirwe yo gutsindira ibihembo bishimishije.",67456128847,"3,500",Payments to Code Holders
06/24/2024,*113*R*A bank deposit of 5000 RWF has been added to your mobile money account at 2024-06-24 14:51:47. Your NEW BALANCE :5420 RWF. Cash Deposit::CASH::::0::250795963036.Thank you for using MTN MobileMoney.*EN#,,5000,Incoming Money
06/24/2024,"*165*S*1500 RWF transferred to Alex Doe (250791666666) from 36521838 at 2024-06-24 14:52:16 . Fee was: 100 RWF. New balance: 3820 RWF. Kugura ama inite cg interineti kuri MoMo, Kanda *182*2*1# .*EN#",,1500,Transfers to Mobile Numbers
06/24/2024,"*165*S*500 RWF transferred to Robert Brown (250789888888) from 36521838 at 2024-06-24 14:56:40 . Fee was: 20 RWF. New balance: 3300 RWF. Kugura ama inite cg interineti kuri MoMo, Kanda *182*2*1# .*EN#",,500,Transfers to Mobile Numbers
06/24/2024,"TxId: 45238324104. Your payment of 1,500 RWF to Robert Brown 66886 has been completed at 2024-06-24 15:03:47. Your new balance: 1,800 RWF. Fee was 0 RWF.Kanda*182*16# wiyandikishe muri poromosiyo ya BivaMoMotima, ugire amahirwe yo gutsindira ibihembo bishimishije.",45238324104,"1,500",Payments to Code Holders
06/24/2024,"TxId: 31373267832. Your payment of 1,000 RWF to Jane Smith 97326 has been completed at 2024-06-24 17:38:59. Your new balance: 800 RWF. Fee was 0 RWF.Kanda*182*16# wiyandikishe muri poromosiyo ya BivaMoMotima, ugire amahirwe yo gutsindira ibihembo bishimishije.",31373267832,"1,000",Payments to Code Holders
06/24/2024,*113*R*A bank deposit of 5000 RWF has been added to your mobile money account at 2024-06-24 18:15:17. Your NEW BALANCE :5800 RWF. Cash Deposit::CASH::::0::250795963036.Thank you for using MTN MobileMoney.*EN#,,5000,Incoming Money
06/24/2024,"*165*S*1000 RWF transferred to Jane Smith (250788999999) from 36521838 at 2024-06-24 18:15:56 . Fee was: 20 RWF. New balance: 4780 RWF. Kugura ama inite cg interineti kuri MoMo, Kanda *182*2*1# .*EN#",,1000,Transfers to Mobile Numbers
06/24/2024,"TxId: 99439041781. Your payment of 4,200 RWF to Alex Doe 41367 has been completed at 2024-06-24 20:40:01. Your new balance: 580 RWF. Fee was 0 RWF.Kanda*182*16# wiyandikishe muri poromosiyo ya BivaMoMotima, ugire amahirwe yo gutsindira ibihembo bishimishije.",99439041781,"4,200",Payments to Code Holders
06/24/2024,*113*R*A bank deposit of 5000 RWF has been added to your mobile money account at 2024-06-24 21:04:26. Your NEW BALANCE :5580 RWF. Cash Deposit::CASH::::0::250795963036.Thank you for using MTN MobileMoney.*EN#,,5000,Incoming Money
06/24/2024,"TxId: 91628513434. Your payment of 2,400 RWF to Alex Doe 29405 has been completed at 2024-06-24 21:06:12. Your new balance: 3,180 RWF. Fee was 0 RWF.Kanda*182*16# wiyandikishe muri poromosiyo ya BivaMoMotima, ugire amahirwe yo gutsindira ibihembo bishimishije.",91628513434,"2,400",Payments to Code Holders
06/24/2024,"*165*S*800 RWF transferred to Linda Green (250791666666) from 36521838 at 2024-06-24 21:39:10 . Fee was: 20 RWF. New balance: 2360 RWF. Kugura ama inite cg interineti kuri MoMo, Kanda *182*2*1# .*EN#",,800,Transfers to Mobile Numbers
06/25/2024,"*165*S*1500 RWF transferred to Samuel Carter (250789888888) from 36521838 at 2024-06-25 09:45:05 . Fee was: 100 RWF. New balance: 760 RWF. Kugura ama inite cg interineti kuri MoMo, Kanda *182*2*1# .*EN#",,1500,Transfers to Mobile Numbers
06/25/2024,*113*R*A bank deposit of 20000 RWF has been added to your mobile money account at 2024-06-25 13:32:23. Your NEW BALANCE :20760 RWF. Cash Deposit::CASH::::0::250795963036.Thank you for using MTN MobileMoney.*EN#,,20000,Incoming Money
06/25/2024,"TxId: 95997298432. Your payment of 3,500 RWF to Jane Smith 79876 has been completed at 2024-06-25 13:32:46. Your new balance: 17,260 RWF. Fee was 0 RWF.Kanda*182*16# wiyandikishe muri poromosiyo ya BivaMoMotima, ugire amahirwe yo gutsindira ibihembo bishimishije.",95997298432,"3,500",Payments to Code Holders
06/25/2024,"*165*S*5000 RWF transferred to Samuel Carter (250790777777) from 36521838 at 2024-06-25 13:37:24 . Fee was: 100 RWF. New balance: 12160 RWF. Kugura ama inite cg interineti kuri MoMo, Kanda *182*2*1# .*EN#",,5000,Transfers to Mobile Numbers
06/25/2024,"TxId: 93272208136. Your payment of 1,500 RWF to Alex Doe 88360 has been completed at 2024-06-25 13:57:32. Your new balance: 10,660 RWF. Fee was 0 RWF.Kanda*182*16# wiyandikishe muri poromosiyo ya BivaMoMotima, ugire amahirwe yo gutsindira ibihembo bishimishije.",93272208136,"1,500",Payments to Code Holders
06/25/2024,"*165*S*1800 RWF transferred to Jane Smith (250788999999) from 36521838 at 2024-06-25 18:25:04 . Fee was: 100 RWF. New balance: 8760 RWF. Kugura ama inite cg interineti kuri MoMo, Kanda *182*2*1# .*EN#",,1800,Transfers to Mobile Numbers
06/25/2024,"TxId: 76500239822. Your payment of 1,200 RWF to Robert Brown 89730 has been completed at 2024-06-25 19:03:16. Your new balance: 7,560 RWF. Fee was 0 RWF.Kanda*182*16# wiyandikishe muri poromosiyo ya BivaMoMotima, ugire amahirwe yo gutsindira ibihembo bishimishije.",76500239822,"1,200",Payments to Code Holders
06/25/2024,"*165*S*2500 RWF transferred to Linda Green (250790777777) from 36521838 at 2024-06-25 20:46:31 . Fee was: 100 RWF. New balance: 4960 RWF. Kugura ama inite cg interineti kuri MoMo, Kanda *182*2*1# .*EN#",,2500,Transfers to Mobile Numbers
06/25/2024,*113*R*A bank deposit of 30000 RWF has been added to your mobile money account at 2024-06-25 22:10:11. Your NEW BALANCE :34960 RWF. Cash Deposit::CASH::::0::250795963036.Thank you for using MTN MobileMoney.*EN#,,30000,Incoming Money
06/25/2024,"TxId: 62680813443. Your payment of 15,000 RWF to Jane Smith 27049 has been completed at 2024-06-25 22:11:05. Your new balance: 19,960 RWF. Fee was 0 RWF.Kanda*182*16# wiyandikishe muri poromosiyo ya BivaMoMotima, ugire amahirwe yo gutsindira ibihembo bishimishije.",62680813443,"15,000",Payments to Code Holders
06/25/2024,"TxId: 60128198918. Your payment of 2,500 RWF to Samuel Carter 28730 has been completed at 2024-06-25 22:12:12. Your new balance: 17,460 RWF. Fee was 0 RWF.Kanda*182*16# wiyandikishe muri poromosiyo ya BivaMoMotima, ugire amahirwe yo gutsindira ibihembo bishimishije.",60128198918,"2,500",Payments to Code Holders
06/25/2024,"*165*S*8000 RWF transferred to Linda Green (250789888888) from 36521838 at 2024-06-25 22:19:18 . Fee was: 100 RWF. New balance: 9360 RWF. Kugura ama inite cg interineti kuri MoMo, Kanda *182*2*1# .*EN#",,8000,Transfers to Mobile Numbers
06/25/2024,"TxId: 45944658885. Your payment of 2,000 RWF to Jane Smith 50933 has been completed at 2024-06-25 23:32:50. Your new balance: 7,360 RWF. Fee was 0 RWF.Kanda*182*16# wiyandikishe muri poromosiyo ya BivaMoMotima, ugire amahirwe yo gutsindira ibihembo bishimishije.",45944658885,"2,000",Payments to Code Holders
06/26/2024,"TxId: 95262102019. Your payment of 2,000 RWF to Robert Brown 69373 has been completed at 2024-06-26 09:52:34. Your new balance: 5,360 RWF. Fee was 0 RWF.Kanda*182*16# wiyandikishe muri poromosiyo ya BivaMoMotima, ugire amahirwe yo gutsindira ibihembo bishimishije.",95262102019,"2,000",Payments to Code Holders
06/26/2024,"*165*S*10000 RWF transferred to Samuel Carter (250788999999) from 36521838 at 2024-06-26 12:55:52 . Fee was: 100 RWF. New balance: 260 RWF. Kugura ama inite cg interineti kuri MoMo, Kanda *182*2*1# .*EN#",,10000,Transfers to Mobile Numbers
06/26/2024,*113*R*A bank deposit of 5000 RWF has been added to your mobile money account at 2024-06-26 12:55:03. Your NEW BALANCE :10360 RWF. Cash Deposit::CASH::::0::250795963036.Thank you for using MTN MobileMoney.*EN#,,5000,Incoming Money
06/26/2024,*113*R*A bank deposit of 5000 RWF has been added to your mobile money account at 2024-06-26 13:48:25. Your NEW BALANCE :5260 RWF. Cash Deposit::CASH::::0::250795963036.Thank you for using MTN MobileMoney.*EN#,,5000,Incoming Money
06/26/2024,"TxId: 87006296823. Your payment of 3,500 RWF to Robert Brown 96044 has been completed at 2024-06-26 13:49:35. Your new balance: 1,760 RWF. Fee was 0 RWF.Kanda*182*16# wiyandikishe muri poromosiyo ya BivaMoMotima, ugire amahirwe yo gutsindira ibihembo bishimishije.",87006296823,"3,500",Payments to Code Holders
06/26/2024,"*165*S*1500 RWF transferred to Alex Doe (250790777777) from 36521838 at 2024-06-26 16:42:17 . Fee was: 100 RWF. New balance: 160 RWF. Kugura ama inite cg interineti kuri MoMo, Kanda *182*2*1# .*EN#",,1500,Transfers to Mobile Numbers
06/26/2024,*113*R*A bank deposit of 30000 RWF has been added to your mobile money account at 2024-06-26 18:38:44. Your NEW BALANCE :30160 RWF. Cash Deposit::CASH::::0::250795963036.Thank you for using MTN MobileMoney.*EN#,,30000,Incoming Money
06/26/2024,"*165*S*25000 RWF transferred to Jane Smith (250791666666) from 36521838 at 2024-06-26 18:40:52 . Fee was: 250 RWF. New balance: 4910 RWF. Kugura ama inite cg interineti kuri MoMo, Kanda *182*2*1# .*EN#",,25000,Transfers to Mobile Numbers
06/26/2024,*162*TxId:14540224719*S*Your payment of 1000 RWF to MTN Cash Power with token 70836-02982-06384-28148 has been completed at 2024-06-26 18:43:34. Fee was 0 RWF. Your new balance: 3910 RWF . Message: - -. *EN#,,1000,Payments to Code Holders
06/26/2024,"*165*S*1000 RWF transferred to Robert Brown (250790777777) from 36521838 at 2024-06-26 19:30:55 . Fee was: 20 RWF. New balance: 2890 RWF. Kugura ama inite cg interineti kuri MoMo, Kanda *182*2*1# .*EN#",,1000,Transfers to Mobile Numbers
06/26/2024,"TxId: 31576470196. Your payment of 2,600 RWF to Samuel Carter 26362 has been completed at 2024-06-26 20:56:26. Your new balance: 290 RWF. Fee was 0 RWF.Kanda*182*16# wiyandikishe muri poromosiyo ya BivaMoMotima, ugire amahirwe yo gutsindira ibihembo bishimishije.",31576470196,"2,600",Payments to Code Holders
06/26/2024,*113*R*A bank deposit of 5000 RWF has been added to your mobile money account at 2024-06-26 21:08:02. Your NEW BALANCE :5290 RWF. Cash Deposit::CASH::::0::250795963036.Thank you for using MTN MobileMoney.*EN#,,5000,Incoming Money
06/26/2024,"TxId: 73458718592. Your payment of 1,300 RWF to Linda Green 68296 has been completed at 2024-06-26 21:15:01. Your new balance: 3,990 RWF. Fee was 0 RWF.Kanda*182*16# wiyandikishe muri poromosiyo ya BivaMoMotima, ugire amahirwe yo gutsindira ibihembo bishimishije.",73458718592,"1,300",Payments to Code Holders
06/27/2024,"TxId: 38607418037. Your payment of 2,000 RWF to Samuel Carter 32097 has been completed at 2024-06-27 10:11:28. Your new balance: 1,990 RWF. Fee was 0 RWF.Kanda*182*16# wiyandikishe muri poromosiyo ya BivaMoMotima, ugire amahirwe yo gutsindira ibihembo bishimishije.",38607418037,"2,000",Payments to Code Holders
06/27/2024,*113*R*A bank deposit of 5000 RWF has been added to your mobile money account at 2024-06-27 12:42:04. Your NEW BALANCE :6990 RWF. Cash Deposit::CASH::::0::250795963036.Thank you for using MTN MobileMoney.*EN#,,5000,Incoming Money
06/27/2024,"TxId: 74528093189. Your payment of 3,000 RWF to Samuel Carter 80358 has been completed at 2024-06-27 12:42:40. Your new balance: 3,990 RWF. Fee was 0 RWF.Kanda*182*16# wiyandikishe muri poromosiyo ya BivaMoMotima, ugire amahirwe yo gutsindira ibihembo bishimishije.",74528093189,"3,000",Payments to Code Holders
06/27/2024,*162*TxId:14551117248*S*Your payment of 2000 RWF to Airtime with token  has been completed at 2024-06-27 15:06:43. Fee was 0 RWF. Your new balance: 1990 RWF . Message: - -. *EN#,,2000,Payments to Code Holders
06/27/2024,"*165*S*800 RWF transferred to Samuel Carter (250788999999) from 36521838 at 2024-06-27 16:46:43 . Fee was: 20 RWF. New balance: 1170 RWF. Kugura ama inite cg interineti kuri MoMo, Kanda *182*2*1# .*EN#",,800,Transfers to Mobile Numbers
06/27/2024,*113*R*A bank deposit of 10000 RWF has been added to your mobile money account at 2024-06-27 19:36:13. Your NEW BALANCE :11170 RWF. Cash Deposit::CASH::::0::250795963036.Thank you for using MTN MobileMoney.*EN#,,10000,Incoming Money
06/27/2024,*113*R*A bank deposit of 5000 RWF has been added to your mobile money account at 2024-06-27 19:38:09. Your NEW BALANCE :16170 RWF. Cash Deposit::CASH::::0::250795963036.Thank you for using MTN MobileMoney.*EN#,,5000,Incoming Money
06/27/2024,"*165*S*11000 RWF transferred to Jane Smith (250789888888) from 36521838 at 2024-06-27 19:38:32 . Fee was: 250 RWF. New balance: 4920 RWF. Kugura ama inite cg interineti kuri MoMo, Kanda *182*2*1# .*EN#",,11000,Transfers to Mobile Numbers
06/28/2024,"TxId: 36124196268. Your payment of 2,000 RWF to Samuel Carter 53745 has been completed at 2024-06-28 11:57:46. Your new balance: 2,920 RWF. Fee was 0 RWF.Kanda*182*16# wiyandikishe muri poromosiyo ya BivaMoMotima, ugire amahirwe yo gutsindira ibihembo bishimishije.",36124196268,"2,000",Payments to Code Holders
06/28/2024,*113*R*A bank deposit of 5000 RWF has been added to your mobile money account at 2024-06-28 13:53:56. Your NEW BALANCE :7920 RWF. Cash Deposit::CASH::::0::250795963036.Thank you for using MTN MobileMoney.*EN#,,5000,Incoming Money
06/28/2024,"TxId: 12278530897. Your payment of 3,500 RWF to Alex Doe 24477 has been completed at 2024-06-28 13:54:35. Your new balance: 4,420 RWF. Fee was 0 RWF.Kanda*182*16# wiyandikishe muri poromosiyo ya BivaMoMotima, ugire amahirwe yo gutsindira ibihembo bishimishije.",12278530897,"3,500",Payments to Code Holders
06/28/2024,*113*R*A bank deposit of 40000 RWF has been added to your mobile money account at 2024-06-28 17:19:26. Your NEW BALANCE :44420 RWF. Cash Deposit::CASH::::0::250795963036.Thank you for using MTN MobileMoney.*EN#,,40000,Incoming Money
06/28/2024,*113*R*A bank deposit of 40000 RWF has been added to your mobile money account at 2024-06-28 17:20:55. Your NEW BALANCE :84420 RWF. Cash Deposit::CASH::::0::250795963036.Thank you for using MTN MobileMoney.*EN#,,40000,Incoming Money
06/28/2024,"*165*S*50000 RWF transferred to Alex Doe (250789888888) from 36521838 at 2024-06-28 17:21:38 . Fee was: 250 RWF. New balance: 34170 RWF. Kugura ama inite cg interineti kuri MoMo, Kanda *182*2*1# .*EN#",,50000,Transfers to Mobile Numbers
06/28/2024,*162*TxId:14568668252*S*Your payment of 2000 RWF to Airtime with token  has been completed at 2024-06-28 17:38:18. Fee was 0 RWF. Your new balance: 32170 RWF . Message: - -. *EN#,,2000,Payments to Code Holders
06/28/2024,*162*TxId:14569120894*S*Your payment of 2000 RWF to Bundles and Packs with token  has been completed at 2024-06-28 18:00:22. Fee was 0 RWF. Your new balance: 30170 RWF . Message: - -. *EN#,,2000,Payments to Code Holders
06/28/2024,"Yello!Umaze kugura 2,000FRW(2GB) igura 2,000 RWF",,"2,000",Internet and Voice Bundle Purchases
06/28/2024,*113*R*A bank deposit of 10000 RWF has been added to your mobile money account at 2024-06-28 23:16:51. Your NEW BALANCE :40170 RWF. Cash Deposit::CASH::::0::250795963036.Thank you for using MTN MobileMoney.*EN#,,10000,Incoming Money
06/28/2024,"TxId: 80699538135. Your payment of 38,500 RWF to Jane Smith 49279 has been completed at 2024-06-28 23:17:22. Your new balance: 1,670 RWF. Fee was 0 RWF.Kanda*182*16# wiyandikishe muri poromosiyo ya BivaMoMotima, ugire amahirwe yo gutsindira ibihembo bishimishije.",80699538135,"38,500",Payments to Code Holders
06/29/2024,*113*R*A bank deposit of 40000 RWF has been added to your mobile money account at 2024-06-29 00:29:42. Your NEW BALANCE :41670 RWF. Cash Deposit::CASH::::0::250795963036.Thank you for using MTN MobileMoney.*EN#,,40000,Incoming Money
06/29/2024,"*164*S*Y'ello,A transaction of 20000 RWF by INTOUCH COMMUNICATIONS  LTD on your MOMO account was successfully completed at 2024-06-29 00:32:19. Message from debit receiver: 250795963036. Your new balance:21670 RWF. Fee was 0 RWF. Financial Transaction Id: 14574631016. External Transaction Id: 169587820240628223202678996.*EN#",,20000,Transfers to Mobile Numbers
06/29/2024,"TxId: 76219803114. Your payment of 16,500 RWF to Alex Doe 31462 has been completed at 2024-06-29 00:42:15. Your new balance: 5,170 RWF. Fee was 0 RWF.Kanda*182*16# wiyandikishe muri poromosiyo ya BivaMoMotima, ugire amahirwe yo gutsindira ibihembo bishimishije.",76219803114,"16,500",Payments to Code Holders
06/29/2024,*113*R*A bank deposit of 50000 RWF has been added to your mobile money account at 2024-06-29 01:13:24. Your NEW BALANCE :55170 RWF. Cash Deposit::CASH::::0::250795963036.Thank you for using MTN MobileMoney.*EN#,,50000,Incoming Money
06/29/2024,"TxId: 49444119897. Your payment of 12,500 RWF to Samuel Carter 80818 has been completed at 2024-06-29 01:16:07. Your new balance: 42,670 RWF. Fee was 0 RWF.Kanda*182*16# wiyandikishe muri poromosiyo ya BivaMoMotima, ugire amahirwe yo gutsindira ibihembo bishimishije.",49444119897,"12,500",Payments to Code Holders
06/29/2024,"TxId: 23617183914. Your payment of 11,500 RWF to Alex Doe 80450 has been completed at 2024-06-29 01:54:26. Your new balance: 31,170 RWF. Fee was 0 RWF.Kanda*182*16# wiyandikishe muri poromosiyo ya BivaMoMotima, ugire amahirwe yo gutsindira ibihembo bishimishije.",23617183914,"11,500",Payments to Code Holders
06/29/2024,"TxId: 77242964085. Your payment of 5,000 RWF to Linda Green 58573 has been completed at 2024-06-29 02:35:39. Your new balance: 26,170 RWF. Fee was 0 RWF.Kanda*182*16# wiyandikishe muri poromosiyo ya BivaMoMotima, ugire amahirwe yo gutsindira ibihembo bishimishije.",77242964085,"5,000",Payments to Code Holders
06/29/2024,"TxId: 46513194998. Your payment of 2,000 RWF to Linda Green 29839 has been completed at 2024-06-29 02:54:58. Your new balance: 24,170 RWF. Fee was 0 RWF.Kanda*182*16# wiyandikishe muri poromosiyo ya BivaMoMotima, ugire amahirwe yo gutsindira ibihembo bishimishije.",46513194998,"2,000",Payments to Code Holders
06/29/2024,"*165*S*20000 RWF transferred to Alex Doe (250789888888) from 36521838 at 2024-06-29 03:44:40 . Fee was: 250 RWF. New balance: 3920 RWF. Kugura ama inite cg interineti kuri MoMo, Kanda *182*2*1# .*EN#",,20000,Transfers to Mobile Numbers
06/29/2024,*113*R*A bank deposit of 100000 RWF has been added to your mobile money account at 2024-06-29 13:16:37. Your NEW BALANCE :103920 RWF. Cash Deposit::CASH::::0::250795963036.Thank you for using MTN MobileMoney.*EN#,,100000,Incoming Money
06/29/2024,"TxId: 91434725399. Your payment of 5,800 RWF to Alex Doe 52731 has been completed at 2024-06-29 13:17:13. Your new balance: 98,120 RWF. Fee was 0 RWF.Kanda*182*16# wiyandikishe muri poromosiyo ya BivaMoMotima, ugire amahirwe yo gutsindira ibihembo bishimishije.",91434725399,"5,800",Payments to Code Holders
06/29/2024,"*165*S*15000 RWF transferred to Jane Smith (250790777777) from 36521838 at 2024-06-29 14:41:22 . Fee was: 250 RWF. New balance: 82870 RWF. Kugura ama inite cg interineti kuri MoMo, Kanda *182*2*1# .*EN#",,15000,Transfers to Mobile Numbers
06/29/2024,"TxId: 92465449198. Your payment of 17,000 RWF to Jane Smith 48732 has been completed at 2024-06-29 15:55:40. Your new balance: 65,870 RWF. Fee was 0 RWF.Kanda*182*16# wiyandikishe muri poromosiyo ya BivaMoMotima, ugire amahirwe yo gutsindira ibihembo bishimishije.",92465449198,"17,000",Payments to Code Holders
06/29/2024,"*164*S*Y'ello,A transaction of 20000 RWF by INTOUCH COMMUNICATIONS  LTD on your MOMO account was successfully completed at 2024-06-29 16:06:06. Message from debit receiver: 250795963036. Your new balance:45870 RWF. Fee was 0 RWF. Financial Transaction Id: 14582579702. External Transaction Id: 169710420240629140334182447.*EN#",,20000,Transfers to Mobile Numbers
06/29/2024,"*165*S*1000 RWF transferred to Robert Brown (250788999999) from 36521838 at 2024-06-29 16:59:53 . Fee was: 20 RWF. New balance: 44850 RWF. Kugura ama inite cg interineti kuri MoMo, Kanda *182*2*1# .*EN#",,1000,Transfers to Mobile Numbers
06/29/2024,"*165*S*15000 RWF transferred to Alex Doe (250790777777) from 36521838 at 2024-06-29 17:45:44 . Fee was: 250 RWF. New balance: 29600 RWF. Kugura ama inite cg interineti kuri MoMo, Kanda *182*2*1# .*EN#",,15000,Transfers to Mobile Numbers
06/29/2024,"TxId: 73443153836. Your payment of 4,000 RWF to Samuel Carter 93083 has been completed at 2024-06-29 18:25:16. Your new balance: 25,600 RWF. Fee was 0 RWF.Kanda*182*16# wiyandikishe muri poromosiyo ya BivaMoMotima, ugire amahirwe yo gutsindira ibihembo bishimishije.",73443153836,"4,000",Payments to Code Holders
06/29/2024,"*165*S*12000 RWF transferred to Samuel Carter (250790777777) from 36521838 at 2024-06-29 20:04:44 . Fee was: 250 RWF. New balance: 13350 RWF. Kugura ama inite cg interineti kuri MoMo, Kanda *182*2*1# .*EN#",,12000,Transfers to Mobile Numbers
06/29/2024,*113*R*A bank deposit of 100000 RWF has been added to your mobile money account at 2024-06-29 20:13:54. Your NEW BALANCE :113350 RWF. Cash Deposit::CASH::::0::250795963036.Thank you for using MTN MobileMoney.*EN#,,100000,Incoming Money
06/29/2024,"TxId: 36547564090. Your payment of 15,000 RWF to Samuel Carter 33167 has been completed at 2024-06-29 20:14:18. Your new balance: 98,350 RWF. Fee was 0 RWF.Kanda*182*16# wiyandikishe muri poromosiyo ya BivaMoMotima, ugire amahirwe yo gutsindira ibihembo bishimishije.",36547564090,"15,000",Payments to Code Holders
06/29/2024,"TxId: 74110530634. Your payment of 3,000 RWF to Jane Smith 36439 has been completed at 2024-06-29 20:26:29. Your new balance: 95,350 RWF. Fee was 0 RWF.Kanda*182*16# wiyandikishe muri poromosiyo ya BivaMoMotima, ugire amahirwe yo gutsindira ibihembo bishimishije.",74110530634,"3,000",Payments to Code Holders
06/29/2024,"TxId: 13627937199. Your payment of 3,000 RWF to Samuel Carter 89385 has been completed at 2024-06-29 20:48:30. Your new balance: 92,350 RWF. Fee was 0 RWF.Kanda*182*16# wiyandikishe muri poromosiyo ya BivaMoMotima, ugire amahirwe yo gutsindira ibihembo bishimishije.",13627937199,"3,000",Payments to Code Holders
06/29/2024,"TxId: 72441399952. Your payment of 5,000 RWF to Robert Brown 56837 has been completed at 2024-06-29 21:14:55. Your new balance: 87,350 RWF. Fee was 0 RWF.Kanda*182*16# wiyandikishe muri poromosiyo ya BivaMoMotima, ugire amahirwe yo gutsindira ibihembo bishimishije.",72441399952,"5,000",Payments to Code Holders
06/29/2024,"TxId: 61734495932. Your payment of 3,000 RWF to Jane Smith 73232 has been completed at 2024-06-29 22:00:11. Your new balance: 84,350 RWF. Fee was 0 RWF.Kanda*182*16# wiyandikishe muri poromosiyo ya BivaMoMotima, ugire amahirwe yo gutsindira ibihembo bishimishije.",61734495932,"3,000",Payments to Code Holders
06/29/2024,"TxId: 60128358762. Your payment of 12,000 RWF to Jane Smith 57243 has been completed at 2024-06-29 22:22:57. Your new balance: 72,350 RWF. Fee was 0 RWF.Kanda*182*16# wiyandikishe muri poromosiyo ya BivaMoMotima, ugire amahirwe yo gutsindira ibihembo bishimishije.",60128358762,"12,000",Payments to Code Holders
06/29/2024,"TxId: 65198686588. Your payment of 3,000 RWF to Samuel Carter 43908 has been completed at 2024-06-29 23:00:54. Your new balance: 69,350 RWF. Fee was 0 RWF.Kanda*182*16# wiyandikishe muri poromosiyo ya BivaMoMotima, ugire amahirwe yo gutsindira ibihembo bishimishije.",65198686588,"3,000",Payments to Code Holders
